,phrase,lf-label
4482, КРОМЕ ТО НОВЫЙ НЕСМЕРТЕЛЬНЫЙ ОРУЖИЕ МОЧЬ ЭФФЕКТИВНО ИСПОЛЬЗОВАТЬ ДЛЯ ВЕДЕНИЕ ОХРАННЫЙ МЕРОПРИЯТИЕ ЗАЩИТА БЛОКПОСТ ГРАНИЦА И МОЧЬ УСПЕШНО ИСПОЛЬЗОВАТЬ ПОЛИЦЕЙСКИЙ ПОДРАЗДЕЛЕНИЕ ДЛЯ БОРЬБА С АНТИПРАВИТЕЛЬСТВЕННЫЙ ДЕМОНСТРАНТ И УЛИЧНЫЙ БЕСПОРЯДКИ,LF
4483, КОНСТРУКТИВНО КОМПЛЕКС КОБА ВЫПОЛНЯТЬ В ВИДЕ ТРАНСФОРМИРОВАТЬ КОМПАКТНЫЙ КОНТЕЙНЕР КОТОРЫЙ ПЕРЕНОСИТЬ НА СПИНА ОДИН БОЕЦ В СКЛАДЫВАТЬ ВИД И СНАРЯЖАТЬ ДВА ЗАРЯД,LF
4484, ДОПОЛНИТЕЛЬНЫЙ БОЕКОМПЛЕКТ МОЧЬ ПЕРЕНОСИТЬ В РАНЕЦ,notLF
4485, НОВЫЙ ИЗДЕЛИЕ ВЫПОЛНЯТЬ НЕСКОЛЬКО ФУНКЦИЯ ПРИСУЩИЙ АРТИЛЛЕРИЙСКИЙ СИСТЕМА МАЛЫЙ КАЛИБР А ТАКЖЕ ПЕРЕНОСНОЙ КОНТЕЙНЕР С ЭЛЕКТРОННЫЙ ОБОРУДОВАНИЕ,LF
4486, ПОМИМО ТРАНСФОРМИРОВАТЬ КОРПУС КОНСТРУКЦИЯ ИМЕТЬ ИНТЕЛЛЕКТУАЛЬНЫЙ НАЧИНКА,notLF
4487, КОМПЛЕКС СНАБЖАТЬ ВСТРАИВАТЬ ПРИЦЕЛЬНЫЙ ПРИСПОСОБЛЕНИЕ ЭЛЕМЕНТ ДЛЯ ВЫВЕРКА ПОЛОЖЕНИЕ НА ГРУНТ ЛАЗЕРНЫЙ ЦЕЛЕУКАЗАТЕЛЬ АВТОНОМНЫЙ ПИТАНИЕ И ДРУГОЙ ЭЛЕМЕНТ ОБЕСПЕЧЕНИЕ ВЫСОКОТОЧНЫЙ СТРЕЛЬБА,notLF
4488, НАЛИЧИЕ ЛАЗЕРНЫЙ ЦЕЛЕУКАЗАТЕЛЬ ОБЕСПЕЧИВАТЬ ТОЧНОСТЬ И ОПЕРАТИВНОСТЬ ПРИЦЕЛИВАНИЕ И ПОРАЖЕНИЕ ЦЕЛЬ С ПЕРВЫЙ ВЫСТРЕЛ,notLF
4489, ПРИ НЕОБХОДИМОСТЬ ВЕДЕНИЕ БОЕВОЙ ДЕЙСТВИЕ КОНТЕЙНЕР В ТЕЧЕНИЕ НЕСКОЛЬКО СЕКУНДА РАСКЛАДЫВАТЬ В ПУСКОВОЙ УСТАНОВКА,notLF
4490, УПРАВЛЕНИЕ СТРЕЛЬБА ЭЛЕКТРИЧЕСКИЙ ПО КАБЕЛЬ ПОСРЕДСТВОМ ДИСТАНЦИОННЫЙ ПУЛЬТ,notLF
4491, ПРИЦЕЛИВАНИЕ ПРИ СТРЕЛЬБА ПРОИЗВОДИТЬ ВРУЧНУЮ ПУТЕМ ИЗМЕНЕНИЕ НАКЛОН СТВОЛ ОТ ГОРИЗОНТАЛЬНЫЙ УРОВЕНЬ ГРУНТ,notLF
4492, ПРИЦЕЛЬНЫЙ ПРИСПОСОБЛЕНИЕ ИМЕТЬ ШКАЛА ГРАДУИРОВАТЬ В МЕТР ДИСТАНЦИЯ ВЫСТРЕЛ ЧТО УПРОЩАТЬ ВЕСЬ ОПЕРАЦИЯ,notLF
4493, ДЛЯ ПРИЦЕЛИВАНИЕ В ПЛОСКОСТЬ ЦЕЛЬ В КОНСТРУКЦИЯ ИМЕТЬСЯ ВСТРАИВАТЬ ЛАЗЕРНЫЙ ЦЕЛЕУКАЗАТЕЛЬ ПЯТНО КОТОРЫЙ УВЕРЕННО НАБЛЮДАТЬ В СОЛНЕЧНЫЙ ДЕНЬ НА МАКСИМАЛЬНЫЙ ДИСТАНЦИЯ ВЫСТРЕЛ,LF
4494, УПРАВЛЕНИЕ ЦЕЛЕУКАЗАТЕЛЬ И СТРЕЛЬБА КОМПЛЕКС КОБА ЭЛЕКТРИЧЕСКИЙ ПОСРЕДСТВОМ МАЛОГАБАРИТНЫЙ ДИСТАНЦИОННЫЙ ПУЛЬТ УПРАВЛЕНИЕ,notLF
4495, НАЛИЧИЕ В КОНСТРУКЦИЯ ДВА СТВОЛ ПОЗВОЛЯТЬ ОПЕРАТИВНО РЕАГИРОВАТЬ НА ИЗМЕНЕНИЕ СИТУАЦИЯ И БЫСТРО ПРОИЗВОДИТЬ ПЕРЕНАЦЕЛИВАНИЕ ИЛИ ИСПОЛЬЗОВАНИЕ РАЗЛИЧНЫЙ ПО НАЗНАЧЕНИЕ ЗАРЯД НА РАЗНЫЙ ДИСТАНЦИЯ,LF
4496, ВОЗМОЖНЫЙ ИСПОЛЬЗОВАНИЕ НЕСКОЛЬКО ТИП ЗАРЯД КОТОРЫЙ ОБЕСПЕЧИВАТЬ ШИРОКИЙ СПЕКТР ЗАДАЧА В ЗАВИСИМОСТЬ ОТ БОЕВОЙ ОБСТАНОВКА,LF
4497, СТРЕЛЬБА ВЕСТИ ПО НАВЕСНОЙ ТРАЕКТОРИЯ НА РАССТОЯНИЕ ОТ 50 ДО 200 МЕТР,LF
4498, НАЛИЧИЕ НАВЕСНОЙ ТРАЕКТОРИЯ ОБЕСПЕЧИВАТЬ ПОРАЖЕНИЕ ЦЕЛЬ В ГОРОДСКОЙ УСЛОВИЕ ЧЕРЕЗ ВЫСОКИЙ ДЕРЕВО ЗДАНИЕ СООРУЖЕНИЕ И Т.Д.,notLF
4499, СУЩЕСТВЕННЫЙ ПРЕИМУЩЕСТВО ТАКОЙ БОЕВОЙ ИСПОЛЬЗОВАНИЕ ОСОБЕННО ВЫГОДНО СКАЗЫВАТЬСЯ В УСЛОВИЕ НАСЕЛЯТЬ ПУНКТ,notLF
4500, В БОЕКОМПЛЕКТ ИМЕТЬСЯ ОСНОВНОЙ ЗАРЯД КЛЕЩ 20 СЕТЬ 12 СЕТЬ 12Х И НЕКОТОРЫЙ ДРУГОЙ ЗАРЯД СПЕЦИАЛЬНЫЙ НАЗНАЧЕНИЕ,notLF
4501, ОСНОВНОЙ ЗАРЯД КЛЕЩ 20 ОБЕСПЕЧИВАТЬ РАЗБРАСЫВАНИЕ В ЗОНА ПОРАЖЕНИЕ СПЕЦИАЛЬНЫЙ СЕТКА ПУТАНКА КОТОРЫЙ КОМПАКТНО УКЛАДЫВАТЬ В КОРПУС ЗАРЯД И РАСКРЫВАТЬ НАД ЗОНА УСТАНОВКА НА ОПРЕДЕЛЕННЫЙ ВЫСОТА,LF
4502," ПУТАНКА ВЫПОЛНЯТЬ ИЗ ПРОВОЛОКА 0,4 МИЛЛИМЕТР И ПЕРЕКРЫВАТЬ ПЛОЩАДЬ РАЗМЕР ОКОЛО 20 НА 20 МЕТР",notLF
4503, В КОНСТРУКЦИЯ ТАКОЙ СПЕЦИАЛЬНЫЙ СЕТКА НЕ ТОЛЬКО ТРАДИЦИОННЫЙ СПИРАЛЬ ПРОВОЛОКА НО И САМОЗАТЯГИВАЮЩИЙСЯ ПЕТЛЯ КОТОРЫЙ КРЕПКО УДЕРЖИВАТЬ НАСТУПАТЬ НА ОНИ ПРОТИВНИК,notLF
4504, ТАКОЙ ОБРАЗ В ТЕЧЕНИЕ НЕСКОЛЬКО СЕКУНДА УСТАНАВЛИВАТЬ ЗАГРАЖДЕНИЕ КОТОРЫЙ СОВЕРШЕННО НЕПРЕОДОЛИМЫЙ ДЛЯ НАСТУПАТЬ ПРОТИВНИК,notLF
4505, КОНСТРУКЦИЯ СЕТКА БЛИЗКИЙ К КОНСТРУКЦИЯ ШИРОКО ИЗВЕСТНЫЙ МАЛОЗАМЕТНЫЙ ПРЕПЯТСТВИЕ ТИП МЗП-1М КОТОРЫЙ МНОГО ГОД УСПЕШНО ИСПОЛЬЗОВАТЬ ПРИ ОХРАНА ОБЪЕКТ,LF
4506, В РЕАЛЬНЫЙ БОЕВОЙ ДЕЙСТВИЕ ВЕСЬ ВИД СТАЦИОНАРНЫЙ ЗАГРАЖДЕНИЕ И ДАЖЕ МАЛОЗАМЕТНЫЙ ЗАГРАЖДЕНИЕ ТИП МЗП-1М МОЧЬ ЗАБЛАГОВРЕМЕННО ВЫЯВЛЯТЬ ПРОТИВНИК,notLF
4507, НОВЫЙ ЗАГРАЖДЕНИЕ МОЧЬ БЫТЬ УСТАНАВЛИВАТЬ НЕПОСРЕДСТВЕННО ПЕРЕД АТАКОВАТЬ ПРОТИВНИК В САМЫЙ ТАКТИЧЕСКИ ВЫГОДНЫЙ И НЕОЖИДАННЫЙ ДЛЯ ОН МЕСТО,notLF
4508, ТАКЖЕ ВОЗМОЖНЫЙ УСТАНАВЛИВАТЬ ЗАГРАЖДЕНИЕ НЕ ТОЛЬКО ПРИ НАСТУПЛЕНИЕ ПРОТИВНИК НО И ПРИ ОН ВЫНУЖДЕННЫЙ ОТСТУПЛЕНИЕ,notLF
4509, ВТОРОЙ ЗАРЯД СЕТЬ 12 ВЫПОЛНЯТЬ ПО БОЛЕЕ ТРАДИЦИОННЫЙ СХЕМА,notLF
4510, ВЫСТРЕЛ ОБЕСПЕЧИВАТЬ НАКРЫТИЕ ПРОТИВНИК КЕВЛАРОВЫЙ СЕТЬ ДИАМЕТР ОКОЛО 12 МЕТР,notLF
4511, КРОМЕ ТО В БОЕКОМПЛЕКТ ИМЕТЬСЯ ВЫСТРЕЛ ТИП СЕТЬ 12Х КОТОРЫЙ ДОПОЛНИТЕЛЬНО ОБРАБАТЫВАТЬ ЦЕЛЬ СЛЕЗОТОЧИВЫЙ ВЕЩЕСТВО ЧТО ЗАТРУДНЯТЬ ВЕДЕНИЕ ПРОТИВНИК АКТИВНЫЙ БОЕВОЙ ДЕЙСТВИЕ,notLF
4512, В БОЕКОМПЛЕКТ ИМЕТЬСЯ ДОПОЛНИТЕЛЬНЫЙ ЗАРЯД СЕТЬ 12 4 КОТОРЫЙ РАЗБРАСЫВАТЬ НЕ ОДИН БОЛЬШОЙ СЕТЬ А ОДНОВРЕМЕННО НЕСКОЛЬКО СЕТЬ МЕНЬШИЙ РАЗМЕР,notLF
4513, ВАРИАНТ ВЫПОЛНЕНИЕ КОМПЛЕКС КОБА МОЧЬ ИСПОЛЬЗОВАТЬ НЕ ТОЛЬКО В ПЕРЕНОСНОЙ ВАРИАНТ,notLF
4514, УПРОЩЕННЫЙ ВАРИАНТ ИСПОЛНЕНИЕ КОБА С ПРЕДУСМАТРИВАТЬ УСТАНОВКА СТРЕЛЯТЬ УСТРОЙСТВО В ОБОРУДОВАТЬ ОКОП,notLF
4515, ТАКОЙ ВАРИАНТ НАИБОЛЕЕ ЭФФЕКТИВНЫЙ ДЛЯ ВЕДЕНИЕ ОХРАННЫЙ МЕРОПРИЯТИЕ,notLF
4516, КОМПЛЕКС КОБА МОЧЬ ИСПОЛЬЗОВАТЬ КАК С ГРУНТ ТАК И С БРОНЕМАШИНА И ТРАНСПОРТНЫЙ СРЕДСТВО,notLF
4517, В СЛУЧАЙ ИСПОЛЬЗОВАНИЕ С БРОНЕМАШИНА ИСПОЛЬЗОВАТЬ ВАРИАНТ КОБА Т ИМЕТЬ ПУЛЬТ УПРАВЛЕНИЕ С УКАЗАТЕЛЬ НА ПАНЕЛЬ ДИСТАНЦИЯ ВЫСТРЕЛ И ДИСТАНЦИОННЫЙ УПРАВЛЕНИЕ ПРИЦЕЛИВАНИЕ,notLF
4518, В ТАКОЙ ВАРИАНТ ИСПОЛЬЗОВАНИЕ БЕЗУСЛОВНО НЕОБХОДИМЫЙ ТАКЖЕ ПРИМЕНЕНИЕ ДОПОЛНИТЕЛЬНЫЙ ЭЛЕМЕНТ КРЕПЛЕНИЕ КОМПЛЕКС НА БРОНЯ ИЛИ КУЗОВ АВТОМОБИЛЬ,notLF
4519, НЕОБХОДИМЫЙ ЗАМЕЧАТЬ ЧТО СТРЕЛЯТЬ МЕХАНИЗМ КОМПЛЕКС РАБОТАТЬ ПРАКТИЧЕСКИ БЕСШУМНО,notLF
4520, ВЫСТРЕЛ НЕ СЛЫШНЫЙ НА РАССТОЯНИЕ 5 8 МЕТР,LF
4521, ТАКОЙ ОСОБЕННОСТЬ БЕСШУМНЫЙ ВЫСТРЕЛ ЗАТРУДНЯТЬ ВОЗМОЖНОСТЬ СВОЕВРЕМЕННЫЙ РЕАГИРОВАНИЕ ПРОТИВНИК НА ИЗМЕНЕНИЕ БОЕВОЙ СИТУАЦИЯ И ПРАКТИЧЕСКИ ИСКЛЮЧАТЬ ВОЗМОЖНОСТЬ ПРОТИВОДЕЙСТВОВАТЬ ОНО,notLF
4522, КОНСТРУКТОРСКИЙ РЕШЕНИЕ ЯВЛЯТЬСЯ ОДИН ИЗ НОУ-ХАУ УКРАИНСКИЙ УЧЕНЫЙ ИСПОЛЬЗОВАТЬ В ДАННЫЙ КОНСТРУКЦИЯ КОМПЛЕКС,notLF
4523, НА ОСНОВА ПУСКОВОЙ КОНТЕЙНЕР КОМПЛЕКС КОБА РАЗРАБАТЫВАТЬ ДРУГОЙ СИСТЕМА СПЕЦИАЛЬНЫЙ ВООРУЖЕНИЕ,notLF
4524, ДЛЯ СИЛА ЧРЕЗВЫЧАЙНЫЙ СИТУАЦИЯ РАЗРАБАТЫВАТЬ СПАСАТЕЛЬНЫЙ КОМПЛЕКС БАРС 100К КОМПЛЕКС ДЛЯ РАЗМИНИРОВАНИЕ ПРОТИВОПЕХОТНЫЙ МИНА БАРСУК КОМПЛЕКС СНЕГ И ДРУГОЙ,notLF
4525, МИХАИЛ ЛЕОНОВИЧ ГАСПАРОВ ВЕЛИКИЙ УЧЕНЫЙ ВЕЛИКИЙ ПРОСВЕТИТЕЛЬ НАШ ВРЕМЯ КАЖДЫЙ ОН КНИГА ДАЖЕ ПЕРЕИЗДАНИЕ СОБЫТИЕ В ИСТОРИЯ КУЛЬТУРА,notLF
4526, ВТОРОЙ ДОПОЛНЯТЬ ИЗДАНИЕ ОЧЕРК ИСТОРИЯ ЕВРОПЕЙСКИЙ СТИХ НЕ ИСКЛЮЧЕНИЕ,notLF
4527, ЭТОТ МОНОГРАФИЯ ПЛЮС ОЧЕРК ИСТОРИЯ РУССКИЙ СТИХ И РУССКИЙ СТИХ НАЧАЛО XX ВЕК В КОММЕНТАРИЙ СОСТАВЛЯТЬ ГРАНДИОЗНЫЙ СТИХОВЕДЧЕСКИЙ ТРИЛОГИЯ БЕСПРЕЦЕДЕНТНЫЙ НЕ ТОЛЬКО В ОТЕЧЕСТВЕННЫЙ НО И В МИРОВОЙ ФИЛОЛОГИЯ,notLF
4528, ПУСТЬ ТАК НО В КАКОЙ МЕРА ЭТОТ КНИГА ДОСТУПНЫЙ ЧИТАТЕЛЬ НЕСПЕЦИАЛИСТ,notLF
4529, ПОЛУЧАТЬ ЛИ ОН УДОВОЛЬСТВИЕ ОТ ПРЕДЛАГАТЬ ОН ПУТЕШЕСТВИЕ В СТРАНА СТИХОВЕДЕНИЕ,LF
4530, НЕ ОТПУГИВАТЬ ЛИ ОН ИЗОБИЛИЕ СТИХОТВОРНЫЙ ПРИМЕР НА 30 ЯЗЫК,LF
4531, ЗАХОТЕТЬ ЛИ ОН КАРАБКАТЬСЯ ПО УСТУП 72 ПАРАГРАФ К НЕДОСТИЖИМЫЙ ЦЕЛЬ,LF
4532, И НЕ ПОВОРАЧИВАТЬ ЛИ НАЗАД НАТЫКАТЬСЯ НА ФРАЗА ТИП МУЗИСТ С СВОЙ РАВНОДОЛГОТНЫЙ ТЕОРИЯ ХОРОШО ПОНИМАТЬ ПОЧЕМУ В ДАКТИЛИЧЕСКИЙ ГЕКЗАМЕТР 4-МОРНЫЙ ДАКТИЛЬ МОЧЬ ЗАМЕНЯТЬ 4-МОРНЫЙ ЖЕ СПОНДЕЙ НО ВСТАВАТЬ В ТУПИК КОГДА НУЖНЫЙ БЫТЬ ОБЪЯСНЯТЬ ПОЧЕМУ В ЯМБИЧЕСКИЙ ТРИМЕТР 3-МОРНЫЙ ЯМБ МОЧЬ ЗАМЕНЯТЬ ТОТ ЖЕ 4-МОРНЫЙ СПОНДЕЙ,LF
4533, БОЛЬШИНСТВО ЧИТАТЕЛЬ ТАК И ДЕЛАТЬ И БЫТЬ КОНЕЧНО ПРАВ,notLF
4534, ОЧЕРК ПРЕДНАЗНАЧАТЬ ДЛЯ МЕНЬШИНСТВО ДЛЯ ТОТ В КТО ЛЮБОВЬ К СТИХИ СОЧЕТАТЬСЯ С ВОЛЯ К ПОЗНАНИЕ,notLF
4535, НО ЗАТО ЧИТАТЬ ЭТОТ КНИГА МОЧЬ УБЕЖДАТЬСЯ ОНА ДОСТУПНЫЙ СЛОЖНЫЙ В ОНА ВЫВОДИТЬ ИЗ ПРОСТОЙ КАЖДЫЙ НЕЗНАКОМЫЙ СЛОВО ОБЪЯСНЯТЬ НА КАЖДЫЙ НЕДОУМЕННЫЙ ВОПРОС БЫТЬ ЧЕТКИЙ ОТВЕТ,notLF
4536, ПОСЛЕДНИЙ ОСОБЕННО ВАЖНЫЙ,notLF
4537, НЕМНОГО НАЙТИСЬ КНИГА ОТВЕЧАТЬ ОДНОВРЕМЕННО И НА СПРАВОЧНЫЙ И НА СПЕЦИАЛЬНЫЙ И НА САМЫЙ ОБЩИЙ ВОПРОС,notLF
4538, ВЫ НАДО СПРАВЛЯТЬСЯ ЧТО ТАКОЙ АЛЛИТЕРАЦИОННЫЙ СТИХ ИЛИ В ЧТО СЕКРЕТ ПИНДАРИЧЕСКИЙ СТРОФА ИСКАТЬ СООТВЕТСТВУЮЩИЙ ГЛАВА,notLF
4539, ВЫ ОЗАДАЧИВАТЬ ПОЧЕМУ ПОСЛОВИЦА ЗАРИФМОВЫВАТЬ ПОЧЕМУ ФРАНЦУЗСКИЙ ПОЭЗИЯ ТАК ПОЗДНО УХОДИТЬ ОТ РИФМА,notLF
4540, ПО ХОД ЧТЕНИЕ ВСЕ РАЗЪЯСНЯТЬСЯ,notLF
4541, АВТОР ОТВЕЧАТЬ ДАЖЕ НА ДЕТСКИЙ ВОПРОС А ЧТО ТАКОЙ СТИХ,LF
4542, СТИХ ЭТО ТЕКСТ ОЩУЩАТЬ КАК РЕЧЬ ПОВЫШЕННЫЙ ВАЖНОСТЬ РАССЧИТЫВАТЬ НА ЗАПОМИНАНИЕ И ПОВТОРЕНИЕ,notLF
4543, НО ЭТО ЕЩЕ НЕ ВСЕ,notLF
4544, ГАСПАРОВ НЕ ТОЛЬКО СТИХОВЕД ОН ЕЩЕ ПОЭТ И ПРОЗАИК,notLF
4545, ПОЭТ ДЕЛАТЬ ЗАМЕЧАТЕЛЬНЫЙ ЭКВИРИТМИЧЕСКИЙ ТО ЕСТЬ СООТВЕТСТВОВАТЬ РИТМ ПОДЛИННИК ПЕРЕВОД РАЗНОЯЗЫЧНЫЙ СТИХОТВОРНЫЙ ОТРЫВОК,LF
4546, ПРОЗАИК ЗАСТАВЛЯТЬ ОЦЕНИВАТЬ КЛАССИФИКАЦИЯ И ЛОГИЧЕСКИЙ СВЯЗКА С ЭСТЕТИЧЕСКИЙ ТОЧКА ЗРЕНИЕ,notLF
4547, УСТАВАТЬ ОТ ХУДОЖЕСТВЕННЫЙ ПРОЗА С ОНА СКУЧНЫЙ ИГРА И ВЫМОРОЧНЫЙ ЯЗЫК ТО БОЛЕЕ РАДОВАТЬСЯ ЖИВОЙ И СВОБОДНЫЙ ИГРА МЫСЛЬ СЛОВО НА СВОЙ МЕСТО ЯСНОСТЬ И МЕРНОСТЬ СЛОГ В КНИГА ГАСПАРОВ,LF
4548, ДЕЛИТЬ НА ВОСЕМЬ,notLF
4549, ПРАВИТЕЛЬСТВО ДОЛЖЕН СТАНОВИТЬСЯ КОМПАКТНЫЙ ПОЛИТИЧЕСКИЙ КАБИНЕТ СТРАТЕГИЧЕСКИЙ ЦЕНТР СВОЙ РОД ВНУТРИРОССИЙСКИЙ БОЛЬШОЙ ВОСЬМЕРКА,notLF
4550, ИМЕННО ВОСЕМЬ ФЕДЕРАЛЬНЫЙ МИНИСТЕРСТВО ВАРИАНТ ОПТИМАЛЬНЫЙ СЧИТАТЬ ГЛАВА РАБОЧИЙ ГРУППА РСПП ПО РАЗРАБОТКА КОНЦЕПЦИЯ АДМИНИСТРАТИВНЫЙ РЕФОРМА АЛЕКСАНДР ШОХИН,notLF
4551, АДМИНИСТРАТИВНЫЙ РЕФОРМА КАК ОЖИДАТЬ СТАНОВИТЬСЯ ОДИН ИЗ ГЛАВНЫЙ ТЕМА ЕЖЕГОДНЫЙ ПОСЛАНИЕ ПРЕЗИДЕНТ ФЕДЕРАЛЬНЫЙ СОБРАНИЕ,notLF
4552, ПРЕДЛОЖЕНИЕ ПО МОДЕРНИЗАЦИЯ ИСПОЛНИТЕЛЬНЫЙ ВЛАСТЬ И ГОССЛУЖБА ПО ПОРУЧЕНИЕ ГЛАВА ГОСУДАРСТВО ГОТОВИТЬ В КРЕМЛЕВСКИЙ АДМИНИСТРАЦИЯ И В ПРАВИТЕЛЬСТВО,LF
4553, КОНЦЕПЦИЯ РЕФОРМА ПРЕЗИДЕНТ ЖДАТЬ И ОТ БИЗНЕС СООБЩЕСТВО,notLF
4554, ОНА РАЗРАБОТКА БЫТЬ ПОРУЧАТЬ РАБОЧИЙ ГРУППА РОССИЙСКИЙ СОЮЗ ПРОМЫШЛЕННИК И ПРЕДПРИНИМАТЕЛЬ РСПП ВО ГЛАВЕ С ПРЕДСЕДАТЕЛЬ НАБЛЮДАТЕЛЬНЫЙ СОВЕТ КОМПАНИЯ РЕНЕССАНС КАПИТАЛ АЛЕКСАНДР ШОХИН,notLF
4555, НА ВСТРЕЧА С ПРЕДСТАВИТЕЛЬ РСПП ПРЕЗИДЕНТ ПРОСИТЬ ПРЕДСТАВЛЯТЬ КОНКРЕТНЫЙ ПРЕДЛОЖЕНИЕ ПО РЕФОРМА,notLF
4556, РАБОЧИЙ ГРУППА ПОДГОТАВЛИВАТЬ ПРОЕКТ ДОКЛАД СООБЩАТЬ АЛЕКСАНДР ШОХИН В ЭКСКЛЮЗИВНЫЙ ИНТЕРВЬЮ ИТОГ,LF
4557, ТЕПЕРЬ С УЧЕТ РАЗВЕРТЫВАТЬСЯ ДИСКУССИЯ В КОТОРЫЙ УЧАСТВОВАТЬ ПРЕДСТАВИТЕЛЬ КРУПНЫЙ БИЗНЕС ГЛАВА ПРАВИТЕЛЬСТВО МИНИСТР ПРЕДСТАВИТЕЛЬ АДМИНИСТРАЦИЯ ПРЕЗИДЕНТ И АППАРАТ ПРАВИТЕЛЬСТВО НА ПРОШЛЫЙ НЕДЕЛЯ БЫТЬ ПРОВОДИТЬ КРУГЛЫЙ СТОЛ С РАЗРАБОТЧИК ПРАКТИЧЕСКИ ВЕСЬ НАПРАВЛЕНИЕ РЕФОРМА КОНЦЕПЦИЯ БЫТЬ КОРРЕКТИРОВАТЬ И НАПРАВЛЯТЬ ЛИЧНО ПРЕЗИДЕНТ,LF
4558, НАЧИНАТЬ ЛЮБОЙ АДМИНИСТРАТИВНЫЙ РЕФОРМА В ТОТ ЧИСЛО И НЫНЕШНИЙ ВСЕ ГОВОРИТЬ О НЕОБХОДИМОСТЬ ПОСТРОЕНИЕ СИЛЬНЫЙ ГОСУДАРСТВО,notLF
4559, В ЧТО ДОЛЖЕН ПРОЯВЛЯТЬСЯ СИЛА ГОСУДАРСТВО С ТОЧКА ЗРЕНИЕ БИЗНЕС СООБЩЕСТВО,notLF
4560, СИЛА ГОСУДАРСТВО В ОНО ЭФФЕКТИВНОСТЬ,notLF
4561, КАК ПОКАЗЫВАТЬ МИРОВОЙ ПРАКТИКА УСПЕХ СОЦИАЛЬНЫЙ ЭКОНОМИЧЕСКИЙ РАЗВИТИЕ В ТОТ ЧИСЛО И ТЕМП РОСТ ПРЯМО ЗАВИСЕТЬ ИМЕННО ОТ ЭФФЕКТИВНОСТЬ ДЕЯТЕЛЬНОСТЬ ГОСУДАРСТВО А НЕ ОТ ОБЪЕМ ГОСУДАРСТВЕННЫЙ ВМЕШАТЕЛЬСТВО В ЭКОНОМИКА И ДРУГОЙ СФЕРА ОБЩЕСТВЕННЫЙ ЖИЗНЬ,notLF
4562, ПОКА ЭТО ДАННЫЕ НА 2002 ГОД ПО ИНДЕКС ЭФФЕКТИВНОСТЬ ПРАВИТЕЛЬСТВО РОССИЯ СТОЯТЬ РЯДОМ С ГРЕЦИЯ И ВЕНЕСУЭЛА ПО РАЗВИТОСТЬ ГОСУДАРСТВЕННЫЙ ИНСТИТУТ СТОЯТЬ РЯДОМ С АРГЕНТИНА И ВЬЕТНАМ ПО ИНДЕКС КОРРУПЦИЯ СОСЕДСТВОВАТЬ С КОТ-Д'ИВУАР И ЗИМБАБВЕ,notLF
4563, А ПРИЧИНА В ТО ЧТО У МЫ В ТЕЧЕНИЕ ВЕСЬ ПЕРИОД РЕФОРМА МОДЕРНИЗАЦИЯ СИСТЕМА ИСПОЛНИТЕЛЬНЫЙ ВЛАСТЬ ЗНАЧИТЕЛЬНО ОТСТАВАТЬ ОТ ТЕМП ИЗМЕНЕНИЕ В ВЕСЬ ДРУГОЙ СФЕРА,notLF
4564, НО ЧЕСТНО ГОВОРИТЬ ПОСКОЛЬКУ РАБОТА ПОРУЧАТЬ В ТОТ ЧИСЛО И САМ ВЕДОМСТВО КОТОРЫЙ НУЖНЫЙ РЕФОРМИРОВАТЬ ПРОЦЕСС ИДТИ ВЯЛО,LF
4565, ФЕДЕРАЛЬНЫЙ ОРГАН ИСПОЛНИТЕЛЬНЫЙ ВЛАСТЬ ПРАКТИЧЕСКИ НЕ ДАВАТЬ ПРЕДЛОЖЕНИЕ ПО СОКРАЩЕНИЕ ГОСУДАРСТВЕННЫЙ ФУНКЦИЯ КОТОРЫЙ ОНИ САМ НАСЧИТЫВАТЬ БОЛЕЕ ПЯТЬ ТЫСЯЧА,notLF
4566, ОЧЕВИДНО НЕ НАХОДИТЬ СРЕДИ ОНИ ИЗБЫТОЧНЫЙ,notLF
4567, У ПРЕДСТАВИТЕЛЬ БИЗНЕС КАК И У МНОГИЕ ЭКСПЕРТ МНЕНИЕ ДРУГОЙ,notLF
4568, В ЧТО ТОГДА ДОЛЖЕН БЫТЬ СУТЬ РЕФОРМА ПО ВЕРСИЯ РСПП,notLF
4569, ЛОГИКА ДЕЙСТВИЕ ТАКОЙ СНАЧАЛА НАДО ОПРЕДЕЛЯТЬ КАКОЙ ФУНКЦИЯ ЯВЛЯТЬСЯ НЕОТЪЕМЛЕМО ГОСУДАРСТВЕННЫЙ И ОТКАЗЫВАТЬСЯ ОТ ВЕСЬ ПРОЧИЙ,notLF
4570, А ПОТОМ СФОРМИРОВЫВАТЬ ОПТИМАЛЬНЫЙ ДЛЯ ОНИ ИСПОЛНЕНИЕ СТРУКТУРА ПРАВИТЕЛЬСТВО И ФЕДЕРАЛЬНЫЙ ОРГАН ИСПОЛНИТЕЛЬНЫЙ ВЛАСТЬ,notLF
4571, СОБСТВЕННО СУТЬ РЕФОРМА В ТО ЧТО ГОСУДАРСТВО ДОЛЖЕН БЫТЬ РОВНО СТОЛЬКО СКОЛЬКО НЕОБХОДИМЫЙ ДЛЯ УСПЕШНЫЙ ЭКОНОМИЧЕСКИЙ РАЗВИТИЕ РАСШИРЕНИЕ ЧАСТНЫЙ ИНИЦИАТИВА И САМОРЕГУЛИРОВАНИЕ СО СТОРОНЫ ГРАЖДАНСКИЙ ОБЩЕСТВО,notLF
4572, ИЛИ СКАЗАТЬ ТАК ЗА ГОСУДАРСТВО ДОЛЖЕН ОСТАВАТЬСЯ ТОЛЬКО ТАКОЙ ФУНКЦИЯ РАСХОД НА ОБЕСПЕЧЕНИЕ КОТОРЫЙ МАЛЫЙ ЧЕМ ВОЗМОЖНЫЙ ПОТЕРЯ ОТ ОНИ НЕИСПОЛНЕНИЕ,notLF
4573, ТОТ ФУНКЦИЯ НЕОБХОДИМОСТЬ КОТОРЫЙ НЕ БЫТЬ ОБОСНОВЫВАТЬ СУЩЕСТВОВАТЬ НЕ ДОЛЖЕН,notLF
4574, А ТОТ ЧТО НУЖНЫЙ НО БОЛЕЕ ЭФФЕКТИВНО ИСПОЛНЯТЬ НЕ ГОСУДАРСТВО ДОЛЖЕН БЫТЬ У ОНО ИЗЫМАТЬ,notLF
4575, ПРАВИТЕЛЬСТВО ОБЕЩАТЬ ПРОВОДИТЬ ТАКОЙ ЭКСПЕРИМЕНТ НА БАЗА ДВА ТРИ МИНИСТЕРСТВО,LF
4576, ВАРИАНТ УПОРЯДОЧЕНИЕ ФУНКЦИЯ НАПРИМЕР ПРОВЕДЕНИЕ ЭКСПЕРИМЕНТ НА ПРИМЕР ДВА ТРИ МИНИСТЕРСТВО РЕЗУЛЬТАТ НА НАШ ВЗГЛЯД НЕ ДАВАТЬ,LF
4577, ЭТО ТОЛЬКО РЕФОРМА ЗАТЯГИВАТЬ ТО БОЛЕЕ ЧТО МОЖНО АНАЛИЗИРОВАТЬ ФУНКЦИЯ ВЕДОМСТВО КОТОРЫЙ ЗАТЕМ ПРИХОДИТЬСЯ УПРАЗДНЯТЬ,notLF
4578, НАИБОЛЕЕ ОЧЕВИДНЫЙ СПОСОБ УСТРАНЕНИЕ ДУБЛИРОВАНИЕ ФУНКЦИЯ ОРГАН ВЛАСТЬ ЯВЛЯТЬСЯ РЕЗКИЙ УМЕНЬШЕНИЕ ОНИ ЧИСЛО,notLF
4579, ПРИ ТАКОЙ ПОДХОД ПРАВИТЕЛЬСТВО СТАНОВИТЬСЯ КОМПАКТНЫЙ ПОЛИТИЧЕСКИЙ КАБИНЕТ,LF
4580, ПОЛИТИЧЕСКИЙ В СМЫСЛ ФОРМИРОВАНИЕ СТРАТЕГИЯ РАЗВИТИЕ СТРАНА,notLF
4581, СВОЙ РОД ВНУТРИРОССИЙСКИЙ БОЛЬШОЙ ВОСЬМЕРКА,notLF
4582, СМЫСЛ НЕ ТОЛЬКО В АНАЛОГИЯ С КЛУБ ЛИДЕР ВЕДУЩИЙ ДЕРЖАВА,notLF
4583, ПО НАШ ПРЕДВАРИТЕЛЬНЫЙ ОЦЕНКА ВОСЕМЬ ФЕДЕРАЛЬНЫЙ МИНИСТЕРСТВО ВАРИАНТ ОПТИМАЛЬНЫЙ,notLF
4584, ПРИ ЭТО ПОДЧЕРКИВАТЬ ЧТО МЫ НЕ СЧИТАТЬ СВОЙ ЦЕЛЬ ОПРЕДЕЛЕНИЕ ЖЕСТКИЙ СТРУКТУРА ИСПОЛНИТЕЛЬНЫЙ ВЛАСТЬ МЫ ПРЕДЛАГАТЬ СКОРЕЕ МОДЕЛЬ СТРОИТЬ НА ПОСЛЕДОВАТЕЛЬНЫЙ РЕАЛИЗАЦИЯ ОСНОВНОЙ ПРИНЦИП АДМИНИСТРАТИВНЫЙ РЕФОРМА РАЗГРАНИЧЕНИЕ ФУНКЦИЯ СОКРАЩЕНИЕ МЕЖВЕДОМСТВЕННЫЙ СОГЛАСОВАНИЕ ЛИКВИДАЦИЯ ОТРАСЛЕВОЙ УПРАВЛЕНИЕ ПОВЫШЕНИЕ ОТВЕТСТВЕННОСТЬ ЗА ИСПОЛНЕНИЕ КОНКРЕТНЫЙ ФУНКЦИЯ,LF
4585, СОКРАЩЕНИЕ ЧИСЛО МИНИСТЕРСТВО ДЕЛАТЬ ПОСЛЕДНИЙ САМОДОСТАТОЧНЫЙ С ТОЧКА ЗРЕНИЕ ПОДГОТОВКА НОРМАТИВНЫЙ АКТ ВЫРАБОТКА ПОЛИТИКА ЧТО РЕЗКО УМЕНЬШАТЬ ДОКУМЕНТООБОРОТ МЕЖДУ ВЕДОМСТВО И АППАРАТ ПРАВИТЕЛЬСТВО ОН ПРЕВРАЩАТЬСЯ ПРИ ЭТОТ ПОДХОД В КАНЦЕЛЯРИЯ ПРЕМЬЕР-МИНИСТР УПРОЩАТЬСЯ МЕХАНИЗМ МЕЖВЕДОМСТВЕННЫЙ СОГЛАСОВАНИЕ ПРИ ВЫРАБОТКА НОРМАТИВНЫЙ РЕШЕНИЕ СОГЛАСОВАНИЕ ДОКУМЕНТ НЕОБХОДИМЫЙ БЫТЬ ПРОВОДИТЬ ЛИШЬ С МИНФИН БЮДЖЕТНЫЙ ПОСЛЕДСТВИЕ И МИНЮСТ СООТВЕТСТВИЕ ЗАКОНОДАТЕЛЬСТВО,LF
4586, КАКОЙ ВЕДОМСТВО ЕСЛИ ОТТАЛКИВАТЬСЯ ОТ ВАШ ПРОЕКТ ДОЛЖЕН ВХОДИТЬ В ВОСЬМЕРКА,notLF
4587, МВД МИД МИНОБОРОНЫ МИНФИН МИНЭКОНОМИКИ МИНЮСТ МИНИСТЕРСТВО ТРУД СОЦЗАЩИТА И ЗДРАВООХРАНЕНИЕ МИНИСТЕРСТВО НАУКА ОБРАЗОВАНИЕ И КУЛЬТУРА,notLF
4588, С ТОЧКА ЗРЕНИЕ ГОСУДАРСТВЕННЫЙ СТРАТЕГИЯ КОМПЛЕКТ ВПОЛНЕ ДОСТАТОЧНЫЙ,notLF
4589, НЕ НУЖНЫЙ БОЛЬШОЙ ЗАЛ ЗАСЕДАНИЕ МОЖНО СОБИРАТЬСЯ В КАБИНЕТ ПРЕМЬЕР КАК ЭТО КСТАТИ ПРИНЯТЫЙ В РЯД СТРАНА,notLF
4590, НАПРИМЕР БРИТАНСКИЙ ПРАВИТЕЛЬСТВО ЗАСЕДАТЬ В ОДИН ИЗ НЕБОЛЬШОЙ ЗАЛ НА ДАУНИНГ-СТРИТ 10,notLF
4591, АНАЛОГИЧНЫЙ СИТУАЦИЯ И В БЕЛЫЙ ДОМ АМЕРИКАНСКИЙ В НАШ МЕСТО МНОГО,LF
4592, ДЕЛО НЕ В СТУЛ КОНЕЧНО,notLF
