,phrase,lf-label
2364, СТУДЕНТ ГОТОВИТЬСЯ К СДАЧА ЭКЗАМЕН ПО МАТЕМАТИКА МОЖНО НАКАНУНЕ СПОКОЙНО ЛОЖИТЬСЯ СПАТЬ НЕ ОПАСАТЬСЯ ЧТО ВМЕСТО ЗАУЧИВАТЬ ФОРМУЛА И ОПРЕДЕЛЕНИЕ НА СЛЕДУЮЩИЙ УТРО ОНИ ВСПОМИНАТЬ СОДЕРЖАНИЕ РАДИОПЕРЕДАЧА СОСЕД ПОЛУНОЧНИК,notLF
2365, ПЛЕСНУТЬ КОЛДОВСТВО,notLF
2366, ВАСИЛИЙ ДЯТЛОВ,notLF
2367, В СИБИРЬ ПРОХОДИТЬ МЕЖДУНАРОДНЫЙ СИМПОЗИУМ ПО ИЗУЧЕНИЕ ШАМАНИЗМ,LF
2368, ОН УЧАСТНИК РЕШАТЬ ДОБИВАТЬСЯ ОФИЦИАЛЬНЫЙ ПРИЗНАНИЕ ТУВА РОДИНА ЭТОТ ДРЕВНИЙ ПЕРВОБЫТНЫЙ ВЕРОВАНИЕ,notLF
2369, ПОЖИЗНЕННЫЙ ВЕРХОВНЫЙ ШАМАН ТУВА РЕСПУБЛИКА ТЫВА ЯВЛЯТЬСЯ ДОКТОР ИСТОРИЧЕСКИЙ НАУКА МОНГУШ КЕНИН-ЛОПСАН ВЫПУСКНИК ВОСТОЧНЫЙ ФАКУЛЬТЕТ ЛЕНИНГРАДСКИЙ ГОСУДАРСТВЕННЫЙ УНИВЕРСИТЕТ АВТОР СОТНЯ ПУБЛИКАЦИЯ О ТУВИНСКИЙ ШАМАН,notLF
2370, МНОГО ПОЛУВЕК ОН СОБИРАТЬ ШАМАНСКИЙ ГИМН ПОБЫВАТЬ В ВЕСЬ САМЫЙ ОТДАЛЕННЫЙ УГОЛОК ТУВА ДРУЖИТЬ С ЗНАТОК ТУВИНСКИЙ СТАРИНА,notLF
2371, ОБЪЕЗЖАТЬ С ЛЕКЦИЯ ДЕСЯТОК СТРАНА МИР ВОЗИТЬ ОН САМ ПОДГОТАВЛИВАТЬ ВЫСТАВКА ПО ШАМАНИЗМ В БЕЛЬГИЯ АВСТРИЯ ГЕРМАНИЯ,notLF
2372, О СЕБЯ 78-ЛЕТНИЙ ШАМАН БЕЗ ЛОЖНЫЙ СКРОМНОСТЬ ГОВОРИТЬ ТАК Я ЯВЛЯТЬСЯ ЧЕЛОВЕК КОТОРЫЙ ПОЛУЧАТЬ ПОЧЕТНЫЙ ТИТУЛ ЖИВОЙ СОКРОВИЩЕ ШАМАНИЗМ АМЕРИКАНСКИЙ ФОНД ШАМАНСКИЙ ИССЛЕДОВАНИЕ,LF
2373, ЭТО ВЕЛИКИЙ НАГРАДА,notLF
2374, В ВЕСЬ МИР ТОЛЬКО ТРОЕ ИЗБРАННЫЙ УДОСТАИВАТЬ ЭТОТ ЧЕСТЬ,LF
2375, ПО ОН УБЕЖДЕНИЕ ТУВА ЯВЛЯТЬСЯ ПРАРОДИНА ШАМАНСТВО А СЕГОДНЯ ОН ЭПИЦЕНТР,notLF
2376, РОДИНА ШАМАНИЗМ СЧИТАТЬ ТУВА И ЗНАМЕНИТЫЙ ФИНСКИЙ АНТРОПОЛОГ И ЭТНОГРАФ ХЕЙМО ЛАППАЛАЙНЕН ПО ИНИЦИАТИВА КОТОРЫЙ 10 ГОД НАЗАД В АВГУСТ 1993 ГОД В ЦЕНТР АЗИЯ НА СВОЙ ПЕРВЫЙ СИМПОЗИУМ СОБИРАТЬСЯ ШАМАН ИЗ АВСТРИЯ КАНАДА АМЕРИКА ГЕРМАНИЯ,notLF
2377, ИНОСТРАНЕЦ В СВОЙ ПЕРВЫЙ ВИЗИТ ВНИМАТЕЛЬНО ПРИСМАТРИВАТЬСЯ К МЕТОД И ПРИЕМ ТУВИНСКИЙ КОЛЛЕГА,notLF
2378, ПОД ВПЕЧАТЛЕНИЕ ВИДЕТЬ УЧАСТНИК ПЕРВЫЙ СИМПОЗИУМ ПО ВОЗВРАЩЕНИЕ ДОМОЙ ПИСАТЬ И ДОКАЗЫВАТЬ В СВОЙ СТАТЬЯ ЧТО ИМЕННО ТУВА ЯВЛЯТЬСЯ РОДИНА ШАМАНИЗМ,notLF
2379, НА НЫНЕШНИЙ СИМПОЗИУМ ПРИЕЗЖАТЬ 14 ЗАРУБЕЖНЫЙ ШАМАН ЧЛЕН АМЕРИКАНСКИЙ ФОНД ШАМАНСКИЙ ИССЛЕДОВАНИЕ ВО ГЛАВЕ С ПАУЛЬ УККУСИЧ ИЗ АВСТРИЯ,notLF
2380, КАК ОН СЧИТАТЬ ШАМАНСТВО ЧРЕЗВЫЧАЙНО ИНТЕРЕСНЫЙ ЯВЛЕНИЕ В ИСТОРИЯ РЕЛИГИЯ ОДИН ИЗ ОНА НАИБОЛЕЕ РАННИЙ ФОРМА ВОЗНИКАТЬ ЕЩЕ В ЭПОХА ПЕРВОБЫТНЫЙ ОБЩЕСТВО,notLF
2381, ОНО ПРИВЛЕКАТЬ ВНИМАНИЕ МЕДИК ПСИХОЛОГ И ПСИХИАТР В СИЛА РЯД ОСОБЕННОСТЬ СВЯЗЫВАТЬ С ДЕЯТЕЛЬНОСТЬ ШАМАН И ОН ЛИЧНОСТЬ СПОСОБ ВОЗДЕЙСТВИЕ ШАМАН НА СВОЙ ПАЦИЕНТ,notLF
2382, СВОЙ ШАМАН ПРИСЫЛАТЬ НА ОЧЕРЕДНОЙ СИМПОЗИУМ ГЕРМАНИЯ ДАНИЯ США ШВЕЙЦАРИЯ ГАВАЙИ,notLF
2383, РОССИЯ БЫТЬ ПРЕДСТАВЛЯТЬ УЧЕНЫЙ И ШАМАН С АЛТАЙ ИЗ КРАСНОЯРСК НОВОСИБИРСК МОСКВА,notLF
2384, ОДИН ИЗ САМЫЙ ЗАГАДОЧНЫЙ И КРАСОЧНЫЙ ЗРЕЛИЩЕ В ШАМАНИЗМ ЭТО КАМЛАНИЕ,notLF
2385, ТАК НАЗЫВАТЬСЯ РИТУАЛ ОБЩЕНИЕ С ДУХ СРЕДИ КОТОРЫЙ ВЕСЬМА ПОЧИТАТЬ СЧИТАТЬ ДУХ ОГОНЬ,notLF
2386, ПОД ЗВУК БУБЕН,notLF
2387, ШАМАН НЕ БЫТЬ БЫ ШАМАН ЕСЛИ БЫ ИЗ СКУЧНЫЙ МЕРОПРИЯТИЕ КАКОЙ ОБЫЧНО БЫВАТЬ ВЕСЬ СИМПОЗИУМ НЕ УСТРАИВАТЬ ЯРКИЙ АКЦИЯ,LF
2388, СОБИРАТЬСЯ РАЗ В 10 ГОД ТАК УЖ СОБИРАТЬСЯ ЧТОБЫ ВСЕ ЗАПОМИНАТЬСЯ НАДОЛГО,notLF
2389, ВЕСЬ КОМПАНИЯ ПОЭТОМУ ОТПРАВЛЯТЬСЯ ИЗ СТОЛИЦА ТУВА КЫЗЫЛ ОТКРЫВАТЬ СИМПОЗИУМ В ОТДАЛЕННЫЙ РАЙОН ПО ПУТЬ ЗАВОРАЧИВАТЬ В ЗНАМЕНИТЫЙ ДОЛИНА ЦАРЬ ГДЕ ВЕСТИ РАСКОПКА ДРЕВНИЙ СКИФСКИЙ КУРГАН ПИТЕРСКИЙ АРХЕОЛОГ,LF
2390, ЗАЕЗЖАТЬ СЮДА НЕ ЛЮБОПЫТСТВО РАДИ,notLF
2391, НА САМЫЙ БОЛЬШОЙ ИЗ 30 КУРГАН ДОЛИНА САЛБЫКСКИЙ ШАМАН ТРАДИЦИОННО ЧЕРПАТЬ ЭНЕРГЕТИЧЕСКИЙ СИЛА,notLF
2392, А ПОКА ПОСВЯЩАТЬ ЗАРЯЖАТЬСЯ НЕПОСВЯЩЕННЫЙ БЫТЬ ПРЕДЛАГАТЬ НЕ ПРОПУСКАТЬ РЕДКИЙ ВОЗМОЖНОСТЬ ЗАГАДЫВАТЬ ЖЕЛАНИЕ У ЭТОТ НЕОБЫКНОВЕННЫЙ КУРГАН,notLF
2393, ЧТОБЫ ОНО СБЫВАТЬСЯ ГОРА НАДО ОБХОДИТЬ А ПОТОМ ЛАДОНЬ ПРИКАСАТЬСЯ К ОДИН ИЗ РАСЩЕЛИНА,notLF
2394, НАКОНЕЦ АВТОБУС ДОБИРАТЬСЯ ДО ПОДНОЖИЕ СВЯЩЕННЫЙ ГОРА ХАЙЫРАКАН,notLF
2395, ОБЫКНОВЕННЫЙ С ВИД ГОРА ЯВЛЯТЬСЯ НА САМЫЙ ДЕЛО ОДИН ИЗ САМЫЙ ПОЧИТАТЬ МЕСТО В РЕСПУБЛИКА,LF
2396, ПО ПРЕДАНИЕ МЕСТО ЭТОТ ОБЛАДАТЬ ОСОБЫЙ МИСТИЧЕСКИЙ СИЛА,notLF
2397, ТУВИНЕЦ УВЕРЯТЬ ЧТО СТОИТЬ ПРОВОДИТЬ НЕСКОЛЬКО МИНУТА НА ГОРА И ПО ВЕСЬ ТЕЛО НАЧИНАТЬ РАЗЛИВАТЬСЯ ПРИЯТНЫЙ ТЕПЛО И НЕОБЫЧАЙНЫЙ ЛЕГКОСТЬ,notLF
2398, НО РАССЛАБЛЯТЬСЯ БЫТЬ НЕ КОГДА,notLF
2399, НАСТУПАТЬ НОЧЬ И УЧАСТНИК СИМПОЗИУМ ПРЕДСТОЯТЬ ПРИСТУПАТЬ К КАМЛАНИЕ РИТУАЛ ОБЩЕНИЕ С ДУХ ОДИН ИЗ САМЫЙ ЗАГАДОЧНЫЙ И КРАСОЧНЫЙ ЗРЕЛИЩЕ,LF
2400, С ПОЛНОЧЬ ДО ПОЛОВИНА СЕДЬМОЙ УТРО БОЙ БОЛЕЕ 20 БУБЕН БЫТЬ СЛЫШНЫЙ ДАЛЕКО ОКРЕСТ,notLF
2401, ВЕДУЩИЙ ШАМАНКА БЫТЬ ТУВИНКА АЙ-ЧУРЕК КОТОРЫЙ ОБЪЯСНЯТЬ ИТОГ ЧТО ЭТОТ КАМЛАНИЕ НЕПОСРЕДСТВЕННО ПОСВЯЩАТЬ ЗДОРОВЬЕ И СЧАСТЬЕ ВЕСЬ ЧЕЛОВЕК,notLF
2402, НАУТРО ШАМАН УЖЕ ЖДАТЬ НА АРААЖН ЛЕЧЕБНЫЙ ИСТОЧНИК КАРА-СУГ,notLF
2403, БОЛЬНОЙ ВЫСТРАИВАТЬСЯ В ПОИСК ИСЦЕЛЕНИЕ В ДЛИННЫЙ ОЧЕРЕДЬ ГОТОВЫЙ БЫТЬ ЖДАТЬ ЧАС,notLF
2404, ДЛЯ ТУВИНЕЦ ШАМАН НЕ ТОЛЬКО ЛЕКАРЬ НО И ХОДЯЧИЙ АПТЕКА,notLF
2405, ПО ДРЕВНИЙ ТУВИНСКИЙ ПОВЕРЬЕ ВЕСЬ БОЛЕЗНЬ ЧЕЛОВЕК ПОСЫЛАТЬ АЗА ЧЕРТ,notLF
2406, ЧЕРТ МОЧЬ УБИВАТЬ ЧЕЛОВЕК,notLF
2407, ТОЛЬКО ШАМАН СУЖДЕН ВИДЕТЬ ЧЕРТ ОН ВСТУПАТЬ С ОН В БОЙ ПОБЕЖДАТЬ ОН В ЖЕСТОКИЙ СХВАТКА И ВОЗВРАЩАТЬ ДУША БОЛЬНОЙ,LF
2408, ПРАКТИКОВАТЬ НЕСКОЛЬКО ВАРИАНТ ЛЕЧЕБНЫЙ ОБРЯД,notLF
2409, ПЕРВЫЙ ОБРЯД НАПРАВЛЯТЬ НА ПРЕДСКАЗАНИЕ ХОРОШИЙ ИЛИ ПЛОХОЙ СОБЫТИЕ В ЖИЗНЬ ЧЕЛОВЕК,notLF
2410, ВТОРОЙ НАПРАВЛЯТЬ НА ПРЕДУПРЕЖДЕНИЕ БОЛЕЗНЬ,notLF
2411, ТРЕТИЙ НАПРАВЛЯТЬ НА ИЗЛЕЧЕНИЕ БОЛЬНОЙ,notLF
2412, ЕСЛИ ЧЕЛОВЕК ЗАБОЛЕВАТЬ НАПРИМЕР РЕВМАТИЗМ СУСТАВ ПРЕДПОЧТЕНИЕ ОТДАВАТЬ ШАМАН ВЕСТИ СВОЙ ПРОИСХОЖДЕНИЕ ОТ ДУХ ЗЕМЛЯ И ВОДА,LF
2413, ЕСЛИ У БОЛЬНОЙ НЕРВНЫЙ НЕДОМОГАНИЕ ДЛЯ ОН ЛЕЧЕНИЕ ПРИГЛАШАТЬ ШАМАН ПРОИСХОДИТЬ ОТ РАЗЛИЧНЫЙ СИЛА ПРИРОДА,notLF
2414, ОСОБО БОЛЬШОЙ РОЛЬ ШАМАН ИМЕТЬ ШАМАН ПРЕДОК,LF
2415, ОНИ СЧИТАТЬ САМЫЙ СИЛЬНЫЙ СПОСОБНЫЙ ПОБЕЖДАТЬ ЛЮБОЙ БОЛЕЗНЬ,notLF
2416, БОЛЬШИНСТВО ИЗ ИНОСТРАННЫЙ ШАМАН ПРИЕЗЖАТЬ НА НЫНЕШНИЙ СИМПОЗИУМ ПСИХОТЕРАПЕВТ,notLF
2417, ОНИ ИЗУЧАТЬ ТАК НАЗЫВАТЬ ШАМАНСКИЙ ПСИХОТЕРАПИЯ ЛЕЧИТЬ БОЛЬНОЙ ОБЩАТЬСЯ С ОН ДУХОВНЫЙ МИР,notLF
2418, ОДИН ИЗ ТАКОЙ ПСИХОТЕРАПЕВТ ГОСПОДИН КУСТ ИЗ ГЕРМАНИЯ ПРИЗНАВАТЬСЯ ИТОГ ЧТО УЖЕ ПОСЛЕ ВТОРОЙ СЕМИНАР ПОНИМАТЬ В МЕТОДИКА ПСИХОТЕРАПЕВТ И ТУВИНСКИЙ ШАМАН МНОГО ОБЩИЙ И ТОТ И ДРУГОЙ ИСКАТЬ ПРИЧИНА НЕДУГ В ВНУТРЕННИЙ МИР ПАЦИЕНТ,LF
2419, А ПРАХ РАЗВЕИВАТЬ НАД КУРГАН,notLF
2420, ЧТО КАСАТЬСЯ НАУЧНЫЙ ЧАСТЬ СИМПОЗИУМ ТО В ПРОГРАММА БЫТЬ ВЫСТУПЛЕНИЕ НА САМЫЙ РАЗНЫЙ ТЕМА ТРАДИЦИОННЫЙ ВЕРОВАНИЕ ТУВИНЕЦ ПРОБЛЕМА ЭВОЛЮЦИЯ ТРАНСФОРМАЦИЯ И ВОЗРОЖДЕНИЕ СЛУЖИТЕЛЬ БУРХАНИЗМ САЯНО-АЛТАЙ И ОНИ ФУНКЦИЯ СООТНОШЕНИЕ ШАМАНСТВО И ИММУНОЛОГИЯ ГДЕ ПЕРЕСЕКАТЬСЯ ШАМАНСТВО И ПСИХОТЕРАПИЯ КАМЛАНИЕ ПСИХОТЕРАПЕВТ С ПОМОЩЬЮ БУБЕН ЗВУКОВОЙ СИМВОЛИКА В ШАМАНСКИЙ ТРАДИЦИЯ И ДРУГОЙ,notLF
2421, МОНГУШ КЕНИН-ЛОПСАН ПОДВОДИТЬ ИТОГ ЗА ПРОХОДИТЬ ПОСЛЕ ПЕРВЫЙ СИМПОЗИУМ 10 ГОД,LF
2422, ЗА ЭТОТ ВРЕМЯ ПО ОН СЛОВО УХОДИТЬ ИЗ ЖИЗНЬ 12 ТУВИНСКИЙ ШАМАН,LF
2423, НЕ СТАТЬ И ОСНОВАТЕЛЬ ИНИЦИАТОР ПЕРВЫЙ СИМПОЗИУМ ФИНН ХЕЙМО ЛАППАЛАЙНЕН,notLF
2424, ОН СКОНЧАТЬСЯ В МАЙ 1994 ГОД,LF
2425, ПОСКОЛЬКУ ОН СЧИТАТЬ ЧТО ГОРА ХАЙЫРАКАН ЯВЛЯТЬСЯ ОДИН ИЗ СИМВОЛ ШАМАНИЗМ ТО В СВОЙ ЗАВЕЩАНИЕ ПРОСИТЬ ЧТОБЫ ОН ПРАХ РАЗВЕИВАТЬ НАД ЭТОТ ГОРА,notLF
2426, ТУВИНСКИЙ ШАМАН ТАК И ПОСТУПАТЬ,notLF
2427, ТОЧНЫЙ ОТВЕТ НА ВОПРОС ПОЧЕМУ ФИНН ИЗЪЯВЛЯТЬ ТАКОЙ ЖЕЛАНИЕ НИКТО ДАВАТЬ НЕ МОЧЬ,LF
2428, ПО СЛОВО ИЗВЕСТНЫЙ ТУВИНСКИЙ РЕЛИГИОВЕД ДОКТОР БУДДИЙСКИЙ ФИЛОСОФИЯ ПРОФЕССОР НИКОЛАЙ АБАЕВ У ФИНН СУЩЕСТВОВАТЬ СВОЙ ОБРЯД,notLF
2429, НА РУСЬ ЧУХОНЕЦ СЛЫТЬ САМЫЙ ИЗОЩРЕННЫЙ КОЛДУН,LF
2430, СОВРЕМЕННЫЙ ЕВРОПЕЙСКИЙ В ТОТ ЧИСЛО И ФИНСКИЙ ШАМАН СВОЙ ТРАДИЦИЯ РАСТЕРИВАТЬ И ПЕРЕНИМАТЬ ОНИ ТЕПЕРЬ У ТУВИНЕЦ КОТОРЫЙ СЧИТАТЬ ОСНОВАТЕЛЬ ШАМАНИЗМ,notLF
2431, С ТОЧКА ЗРЕНИЕ БУДДИЙСКИЙ РЕЛИГИЯ ПОСМЕРТНЫЙ ЖЕЛАНИЕ ХЕЙМО ЛАППАЛАЙНЕН НОНСЕНС И ДАЖЕ СВЯТОТАТСТВО ПОСКОЛЬКУ ГОРА ХАЙЫРАКАН СЧИТАТЬ СВЯЩЕННЫЙ ГОРА И ДЛЯ БУДДИСТ,notLF
2432, ЭТО АНАЛОГИЧНЫЙ ТО ЧТО КАКОЙ-НИБУДЬ МУСУЛЬМАНИН ИЛИ ИУДЕЙ ИЗЪЯВЛЯТЬ ЖЕЛАНИЕ ЧТОБЫ ОН ПРАХ РАЗВЕИВАТЬ НАД ТРОИЦЕ-СЕРГИЕВ ЛАВРА,LF
2433, КАК ПОЯСНЯТЬ ИТОГ БУДДИЙСКИЙ СВЯЩЕННОСЛУЖИТЕЛЬ ТЕНЗИН ЦУЛТИМ БУДДИСТ ВРОДЕ КАК БЫ И НЕ ПРОТИВ ЧТОБЫ ШАМАН ТОЖЕ СЧИТАТЬ ЭТОТ ГОРА СВЯЩЕННЫЙ,notLF
2434, НО ДЕЛО В ТО ЧТО ОТНОШЕНИЕ К ЭТОТ СВЯЩЕННЫЙ ГОРА СО СТОРОНЫ ШАМАН И СО СТОРОНЫ БУДДИСТ ОТЛИЧАТЬСЯ КАК НЕБО И ЗЕМЛЯ,notLF
2435, ПО ОН СЛОВО ПРОВЕДЕНИЕ ПОКАЗАТЕЛЬНЫЙ МАССОВЫЙ ШАМАНСКИЙ КАМЛАНИЕ ПО ВЫЗОВ ДУХ ДАВНО ОТХОДИТЬ В МИР ИНОЙ И ЗАКЛАДКА МЕМОРИАЛЬНЫЙ ДОСКА ПАМЯТЬ ФИНСКИЙ УЧЕНЫЙ ХЕЙМО ЛАППАЛАЙНЕН ЧЕЙ ПРАХ СОГЛАСНО ЗАВЕЩАНИЕ БЫТЬ РАЗВЕИВАТЬ НАД ГОРА ЭТО НАДРУГАТЕЛЬСТВО НАД ПАМЯТЬ ПРЕДОК,LF
2436, БУДДИЙСКИЙ ОБЩИНА ВОСПРИНИМАТЬ ЭТОТ ДЕЙСТВО КАК НЕУМЕСТНЫЙ И НЕ ВПОЛНЕ КОРРЕКТНЫЙ ПО ОТНОШЕНИЮ К ЧУВСТВО ВЕРУЮЩИЙ,notLF
2437, ГОСУДАРСТВО НА СТРАЖА ШАМАНИЗМ,notLF
2438, ПО ДАННЫЕ АДМИНИСТРАЦИЯ РЕСПУБЛИКА ТЫВА СЕГОДНЯ ЗДЕСЬ ОФИЦИАЛЬНО РЕГИСТРИРОВАТЬ 145 ШАМАН И ШАМАНКА ИМЕТЬ НА РУКА СООТВЕТСТВУЮЩИЙ СПРАВКА И ЧЛЕНСКИЙ БИЛЕТ РАЗЛИЧНЫЙ ШАМАНСКИЙ ОБЩЕСТВО,LF
2439, ПОМИМО ОНИ ЕЩЕ ОКОЛО 200 ЮНОША И ДЕВУШКА ЧИСЛИТЬСЯ НАЧИНАТЬ,notLF
2440, ОНИ В ОСНОВНОЕ СПЕЦИАЛИЗИРОВАТЬСЯ НА ПРОВЕДЕНИЕ НЕСЛОЖНЫЙ КУЛЬТОВЫЙ ОБРЯД ПРИ РОЖДЕНИЕ РЕБЕНОК НАСТУПЛЕНИЕ НОВЫЙ ГОД ОЧИЩЕНИЕ СЕМЕЙНЫЙ ОЧАГ,LF
2441, В ЗАКОН РОССИЙСКИЙ ФЕДЕРАЦИЯ О СВОБОДА СОВЕСТЬ И РЕЛИГИОЗНЫЙ ОБЪЕДИНЕНИЕ ШАМАНИЗМ НАПРЯМУЮ НЕ УПОМИНАТЬ,notLF
2442, И ВСЕ ЖЕ ВЛАСТЬ ТУВА АКТИВНО ПОДДЕРЖИВАТЬ ШАМАН,notLF
2443, ГЛАВА РЕСПУБЛИКА ШЕРИГ-ООЛ ООРЖАК ВЫСТУПАТЬ С ПРИВЕТСТВИЕ УЧАСТНИК СИМПОЗИУМ ОСОБО ПОДЧЕРКИВАТЬ ЧТО РАССМАТРИВАТЬ ШАМАНИЗМ КАК ОДИН ИЗ ДРЕВНИЙ ПЛАСТ ДУХОВНЫЙ КУЛЬТУРА ЧЕЛОВЕЧЕСТВО,notLF
2444, ОСОЗНАВАТЬ ВЕСЬ ВАЖНОСТЬ ИЗУЧЕНИЕ ДУХОВНЫЙ КОРЕНЬ И ВОЗРОЖДЕНИЕ ТРАДИЦИЯ НАРОД МЫ И ВПРЕДЬ БЫТЬ ОКАЗЫВАТЬ ВСЕМЕРНЫЙ ПОДДЕРЖКА УСИЛИЕ УЧЕНЫЙ ЗАНИМАТЬСЯ ПРОБЛЕМА ШАМАНИЗМ И СПОСОБСТВОВАТЬ РАЗВИТИЕ ОНИ СВЯЗЬ НА МЕЖДУНАРОДНЫЙ УРОВЕНЬ,LF
2445, ГОСУДАРСТВЕННЫЙ ПОДДЕРЖКА УЖЕ СКАЗЫВАТЬСЯ В ТО ЧТО ФИНАНСОВЫЙ ЗАБОТА О ОРГАНИЗАЦИЯ И ПРОВЕДЕНИЕ СИМПОЗИУМ БРАТЬ НА СЕБЯ ПРАВИТЕЛЬСТВО РЕСПУБЛИКА ТЫВА СОЗДАВАТЬ ОРГКОМИТЕТ ВО ГЛАВЕ С ВИЦЕ-ПРЕМЬЕР АЛДЫН-КЫС КОНГАР И ВЫДЕЛЯТЬ ИЗ РЕСПУБЛИКАНСКИЙ КАЗНА НА ЭТОТ ДЕЛО 140 ТЫСЯЧА РУБЛЬ,notLF
2446, ПО УБЕЖДЕНИЕ ПАТРИАРХ ТУВИНСКИЙ ШАМАНИЗМ МОНГУШ КЕНИН-ЛОПСАН XXI ВЕК БЫТЬ ВЕК ВОЗРОЖДЕНИЕ ШАМАНСТВО,notLF
2447, НА ПРЕДСТОЯЩИЙ МЕЖДУНАРОДНЫЙ ВСТРЕЧА ПО ПРОБЛЕМА ШАМАНИЗМ МЫ БЫТЬ ОБЯЗАТЕЛЬНО ПОДНИМАТЬ ВОПРОС О ОФИЦИАЛЬНЫЙ ПРИЗНАНИЕ ТУВА РОДИНА ШАМАНИЗМ,notLF
2448, СОВРЕМЕННЫЙ ЧЕЛОВЕЧЕСТВО БЫТЬ БЛАГОДАРНЫЙ ТУВИНСКИЙ НАРОД КОТОРЫЙ СОХРАНЯТЬ ЭТОТ ДРЕВНИЙ ВЕРОВАНИЕ В ПЕРВОЗДАННЫЙ ВИД,LF
2449, НА КАНАЛ HALLMARK СНОВА ПРЕМЬЕРА ФИЛЬМ БРЕНТ ШИЛДС СТОЛКНОВЕНИЕ С СУДЬБА BRUSH WITH FATE 2003 ГЛАВНЫЙ РОЛЬ В КОТОРЫЙ СЫГРАТЬ ЭЛЛЕН БЕРСТИН ГЛЕНН КЛОУЗ КЕЛЛИ МАКДОНАЛЬД ПАТРИК БЕРГИН ТОМАС ГИБСОН,LF
2450, В ОСНОВА ФИЛЬМ ЛЕЖАТЬ РОМАН СЬЮЗАН ВИРЛЭНД ДЕВУШКА В ЛИЛОВЫЙ,LF
2451, В РОМАН И В ФИЛЬМ ОПИСЫВАТЬ СОЗДАНИЕ И ДАЛЬНЕЙШИЙ ЗЛОКЛЮЧЕНИЕ ШЕДЕВР ЖИВОПИСЬ XVII ВЕК ПИСАТЬ ГОЛЛАНДСКИЙ ЖИВОПИСЕЦ ЯН ВЕРМЕЕР,LF
2452, КАРТИНА БЫТЬ СОЗДАВАТЬ ПО ВДОХНОВЕНИЕ ПРОДАВАТЬ В МОМЕНТ ОТЧАЯНИЕ ПОКУПАТЬ В ПЫЛ СТРАСТЬ И КРАСТЬ В ПРИПАДОК ЖАДНОСТЬ,notLF
2453, ЭТОТ ПРОИЗВЕДЕНИЕ В ВЕСЬ ВРЕМЯ ЗАВОЕВЫВАТЬ СЕРДЦЕ ПОКУПАТЬ СВОБОДА И СТОИТЬ ЧЕЛОВЕК ЖИЗНЬ,LF
2454, ВЕРМЕЕР ЧАСТО НАЗЫВАТЬ ДЕЛЬФТСКИЙ СФИНКС ОТЧАСТИ ИЗ-ЗА ОТСУТСТВИЕ РАЗВЕРНУТЫЙ БИОГРАФИЧЕСКИЙ СВЕДЕНИЕ ОТЧАСТИ ИЗ-ЗА КРАЙНЕ МАЛЫЙ КОЛИЧЕСТВО РАБОТА КАЖДЫЙ ИЗ КОТОРЫЙ ПО УРОВЕНЬ МАСТЕРСТВО ИСПОЛНЕНИЕ И СИЛА ЭМОЦИОНАЛЬНЫЙ ВОЗДЕЙСТВИЕ СТАВИТЬ ОН В РЯД ВЕЛИКИЙ ХУДОЖНИК,notLF
2455, ОН ПОЛНЫЙ ИМЯ ИОАННЕС ВЕРМЕЕР ВАН ДЕЛЬФТ НО В ВЕСЬ МИР ОН ИЗВЕСТНЫЙ КАК ЯН ВЕРМЕЕР,notLF
2456, ЭТОТ ИМЯ СТОЯТЬ В ОДИН РЯД С ЛЕОНАРДО БОТТИЧЕЛЛИ ЭЛЬ ГРЕКО РЕМБРАНДТ,notLF
2457, А ЕЩЕ СРАВНИТЕЛЬНО НЕДАВНО ОНО БЫТЬ НИКТО НЕ ИЗВЕСТНЫЙ ТОЧНО ВСЕ СПОКОЙНО ЗАБЫВАТЬ,notLF
2458, ЛИШЬ СЛЕПОЙ СЛУЧАЙ ПОМОГАТЬ ОТКРЫВАТЬ ГЕНИАЛЬНЫЙ ХУДОЖНИК,notLF
2459, ИМЕННО ТАК ИЗ СЕРЫЙ БУДНИ НЕБЫТИЕ К СИЯНИЕ МИРОВОЙ СЛАВА ШАГНУТЬ ИЗ ТЬМА СВЕРКАЮЩЕ ЮНЫЙ МАСТЕР ЯН ВЕРМЕЕР,LF
2460, А НАЧИНАТЬСЯ ВСЕ ПРОЗАИЧНО,notLF
2461, ОДНАЖДЫ В СЕРЕДИНА XIX ВЕК СУДЬБА ПРИВОДИТЬ ФРАНЦУЗСКИЙ КРИТИК ТОРЕ В ГААГА,notLF
2462, РЕШАТЬ ПОСЕЩАТЬ МЕСТНЫЙ МУЗЕЙ ОН ДОЛГО БРОДИТЬ ПО АНФИЛАДА ЗАЛ ВНИМАТЕЛЬНО ИЗУЧАТЬ ПОЛОТНО И СКУЛЬПТУРА,notLF
2463, СОБРАНИЕ БЫТЬ ПРЕКРАСНЫЙ НО ВДРУГ ОН ЗАМИРАТЬ ОШЕЛОМЛЯТЬ,notLF
2464, СРЕДИ ПРИВЫЧНЫЙ ПО ТОН КОРИЧНЕВАТЫЙ ЖЕЛТЕТЬ И ТЕМНЕТЬ КАРТИНА ГОЛЛАНДСКИЙ ЖИВОПИСЕЦ XVII ВЕК ОН С ИЗУМЛЕНИЕ ВИДЕТЬ СЛОВНО ОЗАРЯТЬ ИЗНУТРИ МЕРЦАТЬ ХОЛОДНЫЙ ГОЛУБОВАТЫЙ СВЕТ ПОЧТИ СОВРЕМЕННЫЙ ПЕЙЗАЖ,notLF
2465, ПОДПИСЬ ГЛАСИТЬ ВИД ДЕЛЬФТ,notLF
2466, АВТОР ВЕРМЕЕР ДЕЛЬФТСКИЙ,notLF
2467, В ЭТОТ МИНУТА ИЗ БЕЗДНА НЕБЫТИЕ ВОССТАВАТЬ ОДИН ИЗ САМЫЙ ЗАМЕЧАТЕЛЬНЫЙ ХУДОЖНИК ПЛАНЕТА,notLF
2468, ЭКСПАНСИВНЫЙ ПАРИЖАНИН НЕМЕДЛЯ КЛЯСТЬСЯ ПОСВЯЩАТЬ ВЕСЬ СЕБЯ РОЗЫСК ШЕДЕВР НЕВЕДОМЫЙ ОН МАСТЕР,notLF
2469, ВСКОРЕ ОН МОЧЬ ЗАРАЖАТЬ СВОЙ ЭНТУЗИАЗМ ТАКОЙ ЦЕНИТЕЛЬ ИСКУССТВО КАК ТЕОФИЛЬ ГОТЬЕ БРАТ ГОНКУР МАКСИМ ДЮКАН,notLF
2470, МАРСЕЛЬ ПРУСТ ПРЕКЛОНЯТЬСЯ ПЕРЕД ДАР ВЕРМЕЕР ОСТАНАВЛИВАТЬ РЕДКИЙ МГНОВЕНИЕ УЛАВЛИВАТЬ НЕПЕРЕДАВАЕМЫЙ ТОНКИЙ ДВИЖЕНИЕ СЕРДЦЕ,notLF
2471, ЧЕРЕЗ ДЕСЯТОК ДРУГОЙ ГОД ТЩАТЕЛЬНЫЙ ПОИСК ПОЧТИ ВЕСЬ КАРТИНА ДЕЛЬФТСКИЙ МАСТЕР БЫТЬ ОБНАРУЖИВАТЬ,LF
2472, НО ОНИ ОКАЗЫВАТЬСЯ ДО ОБИДНЫЙ МАЛО МАЛО СОРОК,notLF
2473, ПОИСК ПОЛОТНО ВЕРМЕЕР НЕИЗБЕЖНО СТАЛКИВАТЬСЯ С НЕОБХОДИМОСТЬ УЗНАВАТЬ КАКОЙ-ТО СВЕДЕНИЕ О ОН ЖИЗНЬ НО ПОПЫТКА ПРОЯСНЯТЬ БИОГРАФИЯ ХУДОЖНИК ОКАЗЫВАТЬСЯ ПРАКТИЧЕСКИ БЕЗУСПЕШНЫЙ,LF
2474, НО ЧТО-ТО ВСЕ ЖЕ ИЗВЕСТНЫЙ,notLF
2475, ЯН ВЕРМЕЕР РОЖДАТЬСЯ В ГОЛЛАНДСКИЙ ГОРОД ДЕЛЬФТ В 1632 ГОД,LF
2476, ЦЕРКОВНЫЙ АРХИВ СОХРАНЯТЬ СВЕДЕНИЕ О ОН КРЕЩЕНИЕ КОТОРЫЙ СОСТОЯТЬСЯ В ПРОТЕСТАНТСКИЙ НОВЫЙ ЦЕРКОВЬ 31 ОКТЯБРЬ 1632 ГОД,LF
2477, ИЗВЕСТНЫЙ ИМЯ ОН ОТЕЦ РЕЙНЕР ФОС,notLF
2478, СЕМЬЯ ВЕРМЕЕР БЫТЬ ДОСТАТОЧНО СОСТОЯТЕЛЬНЫЙ,notLF
2479, ОН ОТЕЦ ВЛАДЕТЬ ПОСТОЯЛЫЙ ДВОР ЗАНИМАТЬСЯ ТОРГОВЛЯ ПРОИЗВЕДЕНИЕ ИСКУССТВО И ПРОИЗВОДСТВО ТОНКИЙ ШЕЛКОВЫЙ ТКАНЬ,LF
2480, В 1653 ГОД ВЕРМЕЕР СТАНОВИТЬСЯ ЧЛЕН ГИЛЬДИЯ СВЯТОЙ ЛУКА НАЗЫВАТЬ ТАК В ЧЕСТЬ ПОКРОВИТЕЛЬ ХУДОЖНИК,LF
2481, ЧЕРЕЗ ДЕВЯТЬ ГОД ЧЛЕНСТВО ОН БЫТЬ ИЗБИРАТЬ ВИЦЕ-ПРЕЗИДЕНТ ГИЛЬДИЯ И ЗАНИМАТЬ ЭТОТ ДОЛЖНОСТЬ С 1662 ПО 1671 ГОД,LF
2482, БЫТЬ СВЕДЕНИЕ СОГЛАСНО КОТОРЫЙ В 1672 ГОД ВЕРМЕЕР ПРЕДЛАГАТЬ СТАНОВИТЬСЯ ЭКСПЕРТ НЕКИЙ ГААГСКИЙ КОЛЛЕКЦИЯ ИТАЛЬЯНСКИЙ КАРТИНА,LF
2483, В ГОД ВСТУПЛЕНИЕ В ГИЛЬДИЯ ВЕРМЕЕР ЖЕНИТЬСЯ НА КАТОЛИЧКА КАТАРИНА БОЛНЕС,notLF
2484, В СЕМЬЯ ЯН ВЕРМЕЕР И КАТАРИНА БОЛНЕС РОЖДАТЬСЯ 15 РЕБЕНОК ЧЕТВЕРО ИЗ КОТОРЫЙ УМИРАТЬ ЕЩЕ В МЛАДЕНЧЕСТВО,LF
2485, СЛОЖНЫЙ ПОЛИТИЧЕСКИЙ СИТУАЦИЯ В СТРАНА ВОЙНА С ФРАНЦИЯ И СЛЕДОВАТЬ ВСЛЕД ЗА ЭТО КРИЗИС НАСТУПАТЬ В ГОЛЛАНДИЯ В 1672 ГОД ПРИВОДИТЬ СЕМЬЯ ВЕРМЕЕР К РАЗОРЕНИЕ,LF
2486, БЕДСТВЕННЫЙ ПОЛОЖЕНИЕ УСКОРЯТЬ КОНЧИНА ХУДОЖНИК УМИРАТЬ 16 ДЕКАБРЬ 1675 ГОД ОТ СЕРДЕЧНЫЙ ПРИСТУП,notLF
2487, ДО НАСТОЯЩИЙ ВРЕМЯ НЕ ДОХОДИТЬ ДОКУМЕНТАЛЬНЫЙ СВИДЕТЕЛЬСТВО О ТО ПОКИДАТЬ ЛИ ОН ГОРОД,notLF
2488, НЕТ ЗАПИСЬ УКАЗЫВАТЬ НА ЧЕЛОВЕК КОТОРЫЙ МОЧЬ БЫТЬ ОН УЧИТЕЛЬ УЧЕНИК ЗАКАЗЧИК,notLF
2489, ПО-ВИДИМОМУ ВЕРМЕЕР ВЕСТИ СКРОМНЫЙ ОБРАЗ ЖИЗНЬ А КАК ЖИВОПИСЕЦ НЕ БЫТЬ ПРИЗНАВАТЬ СОВРЕМЕННИК,notLF
2490, ПОСЛЕ ОН СМЕРТЬ ВДОВА ВЫНУЖДЕННЫЙ БЫТЬ ПРОДАВАТЬ ОСТАВАТЬСЯ В ДОМ РАБОТА ЗА БЕСЦЕНОК ДАБЫ ВЫПЛАЧИВАТЬ НАКАПЛИВАТЬСЯ ДОЛГ,notLF
2491, А БИОГРАФ ГОЛЛАНДСКИЙ ХУДОЖНИК А. ХАУБРАКЕН РАСЦВЕТ ДЕЯТЕЛЬНОСТЬ КОТОРЫЙ ПРИХОДИТЬСЯ НЕМНОГИЕ ГОД ПОЗЖЕ ЗАВЕРШЕНИЕ ЖИЗНЕННЫЙ ПУТЬ ВЕРМЕЕР В ЛЕКСИКОН ИЗДАВАТЬ В АМСТЕРДАМ С 1718-Й ПО 1721 ГОД НАЗЫВАТЬ ЛИШЬ ИМЯ И ДАТА РОЖДЕНИЕ ХУДОЖНИК,notLF
