,phrase,lf-label
6729, ПО МНЕНИЕ КАЗАХСТАНСКИЙ И НЕКОТОРЫЙ ДРУГОЙ УЧЕНЫЙ НАМЕРЕННЫЙ ФАЛЬСИФИКАЦИЯ ИСТОРИЧЕСКИЙ ФАКТ НАЧИНАТЬСЯ С ПРАВЛЕНИЕ ИВАН ГРОЗНЫЙ,LF
6730, ПРИЧИНА ФАЛЬСИФИКАЦИЯ МНОГИЕ УЧЕНЫЙ НАЗЫВАТЬ ПОПЫТКА СТИРАТЬ ИЗ ПАМЯТЬ РУССКИЙ НАРОД ФАКТ ПОРАБОЩЕНИЕ ОНИ ПРЕДОК ДИКИЙ ОРДА,notLF
6731, ПО ОФИЦИАЛЬНЫЙ ДАННЫЕ ЧИНГИСХАН НАСТОЯЩИЙ ИМЯ ТЕМУЧИН РОЖДАТЬСЯ НА ТЕРРИТОРИЯ СОВРЕМЕННЫЙ МОНГОЛИЯ В 1155 ГОД В РОД КИЯТ,LF
6732, КАК ИЗВЕСТНЫЙ В 1206 ГОД ВО ВРЕМЯ КУРУЛТАЙ ВСЕОБЩИЙ СОБРАНИЕ ПРАВИТЕЛЬ РОД ТЕМУЧИН ПРОВОЗГЛАШАТЬ ХАН И ДАВАТЬ ОН НОВЫЙ ИМЯ ЧИНГИСХАН ХАН ВОСТОК,LF
6733, И БРАТЬ В ВНИМАНИЕ ТО ЧТО УЧАСТНИК КУРУЛТАЙ БЫТЬ КАЗАХСКИЙ РОД КИЯТ МЕРКИТ ЖАЛАИР И АРГЫН УЧЕНЫЙ УТВЕРЖДАТЬ ЧТО ЧИНГИСХАН БЫТЬ ИМЕННО КАЗАХ,notLF
6734, ПРИ ЭТО ВЫШЕПЕРЕЧИСЛЕННЫЙ РОД ДЕЙСТВИТЕЛЬНО СЧИТАТЬ КАЗАХСКИЙ НО ВЫХОДЕЦ ИЗ ЭТОТ ПЛЕМЯ ПРИНЯТЫЙ НАЗЫВАТЬ КАЗАХ МОНГОЛЬСКИЙ ПРОИСХОЖДЕНИЕ,notLF
6735, МОНГОЛ ВООБЩЕ НИКАКОЙ ОТНОШЕНИЕ К ЧИНГИСХАН НЕ ИМЕТЬ ТАК КАК НА ТОТ ТЕРРИТОРИЯ В ТОТ ВРЕМЯ ОНИ НЕ ЖИТЬ ПОЭТОМУ САМ ФАКТ ДЕЛЕНИЕ КАЗАХ НА КАЗАХ МОНГОЛЬСКИЙ ПРОИСХОЖДЕНИЕ И КАЗАХСКИЙ ПРОИСХОЖДЕНИЕ НОНСЕНС ГОВОРИТЬ ГЛАВНЫЙ ОРГАНИЗАТОР КОНФЕРЕНЦИЯ ПРОФЕССОР КАЙРАТ ЗАКИРЬЯНОВ,LF
6736, ТАКОЙ ИСТОРИК КАК КАРАМЗИН СПОСОБСТВОВАТЬ ТО ЧТОБЫ ПОДОБНЫЙ РАЗДЕЛЕНИЕ СЧИТАТЬ ПРАВИЛЬНЫЙ,notLF
6737, ЕЩЕ ОДИН СЕРЬЕЗНЫЙ ДОКАЗАТЕЛЬСТВО ТО ЧТО ЧИНГИСХАН КАЗАХ УЧЕНЫЙ СЧИТАТЬ ТО ЧТО ПРАКТИЧЕСКИ ВЕСЬ ЧИНГИЗИД ПРЯМОЙ ПОТОМОК ЧИНГИСХАН БЫТЬ КАЗАХ ПРАВИТЬ КАЗАХСКИЙ ГОСУДАРСТВО ВПЛОТЬ ДО НАЧАЛО ДВАДЦАТЫЙ ВЕК,notLF
6738, ОТСЮДА БРАТЬ НАЧАЛО ПОНЯТИЕ БЕЛЫЙ КОСТЬ ПРОСЛОЙКА АРИСТОКРАТ СУЩЕСТВОВАТЬ В СОЦИАЛЬНЫЙ ИЕРАРХИЯ КАЗАХСКИЙ ОБЩЕСТВО,LF
6739, О ТО ЧТО НАМЕРЕНИЕ ВЕРНУТЬ СЕБЯ БЛУДНЫЙ СЫН ИСТОРИЯ КАК НИКОГДА СЕРЬЕЗНЫЙ ГОВОРИТЬ ФАКТ ВОВЛЕЧЕНИЕ В КАМПАНИЯ ВЫСОКИЙ ПРАВИТЕЛЬСТВЕННЫЙ ЧИН,LF
6740, ЭКС-ПРЕМЬЕР-МИНИСТР КАЗАХСТАН ИМАНГАЛИ ТАСМАГАМБЕТОВ ВО ВРЕМЯ СВОЙ ПРЕБЫВАНИЕ НА ПОСТ ВТОРОЙ ЧЕЛОВЕК В СТРАНА РАСПОРЯДИТЬСЯ ДЕЛАТЬ КОПИЯ КАМЕНЬ КЮЛЬТЕГИН,LF
6741, КАМЕНЬ КЮЛЬТЕГИН ИЗВЕСТНЫЙ КАМЕННЫЙ ИЗВАЯНИЕ СУЩЕСТВОВАТЬ НА ТЕРРИТОРИЯ СОВРЕМЕННЫЙ МОНГОЛИЯ,LF
6742, ИЗВЕСТНЫЙ ОНО ПРЕЖДЕ ВСЕГО ТО ЧТО НА ОНО БЫТЬ ВЫСЕКАТЬ СВЕДЕНИЕ О ВЕЛИКИЙ ПОДВИГ УЙГУРСКИЙ ВОИН КЮЛЬТЕГИН,notLF
6743, НАДПИСЬ ДЕЛАТЬ НА КАЗАХСКИЙ ЯЗЫК УЙГУРСКИЙ ПИСЬМЕННОСТЬ И ИМЕТЬ БОЛЬШОЙ ИСТОРИЧЕСКИЙ ЦЕННОСТЬ,LF
6744, КОПИЯ ИЗВАЯНИЕ НАХОДИТЬСЯ В СТОЛИЦА КАЗАХСТАН АСТАНА В ЗДАНИЕ НАЦИОНАЛЬНЫЙ УНИВЕРСИТЕТ ИМЯ ЛЕВ ГУМИЛЕВ,LF
6745, ТАКОЙ ОБРАЗ МОЖНО КОНСТАТИРОВАТЬ ТО ЧТО КАЗАХСТАНСКИЙ ЭЛИТА БРАТЬСЯ ЗА ДЕЛО ВОЗВРАЩЕНИЕ ЭТНОС ОН ГЕРОЙ С ПОЛНЫЙ ПОНИМАНИЕ СЕРЬЕЗНОСТЬ ДАННЫЙ ВОПРОС,notLF
6746, НАРЯДУ С КАЗАХСТАН ВОПРОС ИЗМЕНЕНИЕ ОФИЦИАЛЬНЫЙ ГЕНЕАЛОГИЧЕСКИЙ ДРЕВО ЧИНГИСХАН ВОЛНОВАТЬ И КИТАЙ,notLF
6747, ПОЖАЛУЙ ГЛАВНЫЙ ДОКАЗАТЕЛЬСТВО ЭТО МОЖНО СЧИТАТЬ ВОЗДВИЖЕНИЕ В ПЕКИН МАВЗОЛЕЙ ЧИНГИСХАН,notLF
6748, К ВСЕ ПРОЧИЙ ПОТРЯСАТЕЛЬ ВСЕЛЕННАЯ БЫТЬ ОФИЦИАЛЬНО ВКЛЮЧАТЬ В ПОЧЕТНЫЙ РЕЕСТР ВЕЛИКИЙ КИТАЙСКИЙ ИМПЕРАТОР,notLF
6749, ПРИ ЭТО В ПОСОЛЬСТВО КИТАЙ НИЧТО ВРАЗУМИТЕЛЬНЫЙ ОТНОСИТЕЛЬНО МАВЗОЛЕЙ Я НЕ СКАЗАТЬ ССЫЛАТЬСЯ НА СВОЙ НЕКОМПЕТЕНТНОСТЬ,notLF
6750, ПРЕДСТАВИТЕЛЬ ДИПЛОМАТИЧЕСКИЙ КОРПУС МОНГОЛИЯ САМ БЫТЬ КРАЙНЕ УДИВЛЯТЬ МОЙ ВОПРОС ПОХОЖЕ ДЛЯ ОНИ ПОТОМСТВЕННЫЙ СВЯЗЬ С ЧИНГИСХАН ЯВЛЯТЬСЯ АКСИОМА,notLF
6751, ЕСЛИ ПЫТАТЬСЯ ВНИКАТЬ В СУТЬ ПРИЧИНА КОТОРЫЙ ТОЛКАТЬ КИТАЙСКИЙ И КАЗАХСТАНСКИЙ ИСТОРИК НА ПОДОБНЫЙ РОД МАНЕВР В ПРОЦЕСС ОТБИВАНИЕ У МОНГОЛ КАЗАТЬСЯ БЫ БЕССПОРНЫЙ ПРЕДОК ОНИ ПРЕДЕЛЬНО ЯСНЫЙ,notLF
6752, КАЗАХСТАН КАК ГОСУДАРСТВО МОЛОДОЙ ЗА ТРИНАДЦАТЬ ГОД НЕЗАВИСИМОСТЬ ТАК НИЧТО И НЕ ЗАПОЛНЯТЬ ИДЕОЛОГИЧЕСКИЙ НИША,notLF
6753, ПОЭТОМУ ЧРЕЗВЫЧАЙНО ВАЖНЫЙ ФИГУРА ИМЕННО ЧИНГИСХАН ИБО ОНА МОЧЬ БЫТЬ ЗАКЛАДЫВАТЬ В ФУНДАМЕНТ ИДЕЯ ЕВРАЗИЙСТВО,LF
6754, ТРУДНЫЙ СКАЗАТЬ К ЧТО КРОМЕ ЖАРКИЙ ДИСКУССИЯ В КОНЕЧНЫЙ ИТОГ ПРИВОДИТЬ УСИЛИЕ КАЗАХСТАНСКИЙ ИСТОРИК И КУЛЬТУРОЛОГ СЧИТАТЬ ЧИНГИСХАН КАЗАХ,LF
6755, НО ПОВТОРЯТЬСЯ ОПРЕДЕЛЕННО ЯСНЫЙ ТО ЧТО В СТРАНА ЭТОТ ВОПРОС ГРОЗИТЬ ПРИОБРЕТАТЬ ЧУТЬ ЛИ НЕ ИДЕОЛОГИЧЕСКИЙ ОСНОВА,LF
6756, СРЕДСТВО МАССОВЫЙ ИНФОРМАЦИЯ НА ПРОТЯЖЕНИЕ ПОСЛЕДНИЙ ГОД ПЕРЕГРУЖАТЬ ДИСПУТ НА ТЕМА ЧИНГИСХАН,notLF
6757, БОЛЕЕ ТО ЧИНГИСХАН ПРИПИСЫВАТЬ СОХРАНЕНИЕ КАЗАХСКИЙ ЭТНОС ТАК КАК ИМЕННО ОН КАК ТВЕРДИТЬ УЧЕНЫЙ МУЖ СОБИРАТЬ ВЕСЬ КАЗАХ ВМЕСТЕ И ПЕРЕСЕЛЯТЬ С ТЕРРИТОРИЯ СОВРЕМЕННЫЙ МОНГОЛИЯ ТУДА ГДЕ И ЗНАЧИТЬСЯ СЕГОДНЯ КАЗАХСТАН,notLF
6758, ТАКОЙ ОБРАЗ ВЫХОДИТЬ ЧТО КАЗАХСКИЙ ГОСУДАРСТВЕННОСТЬ СТАТЬ ФОРМИРОВАТЬСЯ ИМЕННО ПО ИДЕЯ ЧИНГИСХАН В НАЧАЛО XIII ВЕК А НЕ В СЕРЕДИНА XVI КАК СЧИТАТЬ РАНО,LF
6759, А ЭТО УЖЕ НЕ ШУТКА,notLF
6760, ИНОЙ СЛОВО ПОКА МОНГОЛ МИРНО ПАСТИ СВОЙ СТАДО И ЖДАТЬ ДЕНЬ СВЯЩЕННЫЙ ЮБИЛЕЙ ПРЕДПРИИМЧИВЫЙ СОСЕД ЗАНИМАТЬ ТРУД ПО КАРДИНАЛЬНЫЙ ИЗМЕНЕНИЕ ИСТОРИЧЕСКИЙ ФАКТ,LF
6761, КОНФЕРЕНЦИЯ В АЛМА-АТА ЭТО ОЧЕНЬ ПОКАЗАТЕЛЬНЫЙ И ВЕСОМЫЙ ШАГ ПОКАЗЫВАТЬ ЧТО БИТЬСЯ И ТОТ И ДРУГОЙ ЗА РЫЖЕБОРОДЫЙ ПОТРЯСАТЕЛЬ БЫТЬ ВСЕРЬЕЗ,notLF
6762, ФРАНЦИЯ ПРИЗНАВАТЬ РОССИЙСКИЙ СТУДЕНТ И НЕ ПРИЗНАВАТЬ РОССИЙСКИЙ ДИПЛОМ,notLF
6763, МИРОВОЙ ОБРАЗОВАТЕЛЬНЫЙ РЫНОК ГОТОВИТЬСЯ К АБИТУРИЕНТСКИЙ СТРАДА,notLF
6764, С 5 ПО 7 МАРТ В МОСКВА ПРОХОДИТЬ ВЫСТАВКА ОБРАЗОВАНИЕ И КАРЬЕРА НА КОТОРЫЙ БЫТЬ ПРЕДСТАВЛЯТЬ НЕ ТОЛЬКО РОССИЙСКИЙ НО И ВЕДУЩИЙ ЗАПАДНЫЙ ВЫСШИЙ УЧЕБНЫЙ ЗАВЕДЕНИЕ,LF
6765, ОДИН ИЗ САМЫЙ БОЛЬШОЙ ЭКСПОЗИЦИЯ ПО ТРАДИЦИЯ ПРИВОЗИТЬ ФРАНЦИЯ,LF
6766, СВОЙ СТЕНД ПОДГОТАВЛИВАТЬ 30 ФРАНЦУЗСКИЙ ВУЗ И 17 ФИРМА И КОМПАНИЯ РАБОТАТЬ НА РОССИЙСКИЙ РЫНОК,notLF
6767, НА PRESS-PARTY ПОСВЯЩАТЬ ЭТОТ ВЫСТАВКА ПОСОЛ ФРАНЦИЯ В РОССИЯ КЛОД БЛАНШМЕЗОН ЗАЯВЛЯТЬ ЧТО ОН СТРАНА ВЕСЬМА ЗАИНТЕРЕСОВАННЫЙ В ОБРАЗОВАТЕЛЬНЫЙ ОБМЕН,notLF
6768, ИМЕННО ПОЭТОМУ ВУЗ ПЯТЫЙ РЕСПУБЛИКА В ТРИ РАЗ УВЕЛИЧИВАТЬ КВОТА ДЛЯ РОССИЙСКИЙ СТУДЕНТ,notLF
6769, РУССКИЙ СТУДЕНТ ИМЕТЬ ОГРОМНЫЙ ПОТЕНЦИАЛ ОТЛИЧНЫЙ ТЕОРЕТИЧЕСКИЙ ЗНАНИЕ И МОЧЬ ДАВАТЬ ТОЛЧОК РАЗВИТИЕ ФРАНЦУЗСКИЙ ВЫСШИЙ ШКОЛА СЧИТАТЬ ГОСПОДИН БЛАНШМЕЗОН,notLF
6770, КРОМЕ ТО НАШ ПРЕДПРИЯТИЕ РАБОТАТЬ НА РОССИЙСКИЙ РЫНОК НУЖДАТЬСЯ В КВАЛИФИЦИРОВАННЫЙ СПЕЦИАЛИСТ УМЕТЬ ВЕСТИ БИЗНЕС,LF
6771, В ФРАНЦИЯ СЕЙЧАС УЧИТЬСЯ 6 ТЫСЯЧА КИТАЙСКИЙ СТУДЕНТ,notLF
6772, НАШ ИНТЕРЕС В РОССИЯ СТОЛЬ ЖЕ БОЛЬШОЙ КАК И В КИТАЙ,notLF
6773, ТАК ЧТО НЕ СЛУЧАЙНО ВО ВРЕМЯ НЕДАВНИЙ ВСТРЕЧА С ВЛАДИМИР ПУТИН ЖАК ШИРАК ПРЕДЛАГАТЬ УВЕЛИЧИВАТЬ ЧИСЛО РОССИЙСКИЙ СТУДЕНТ ОТПРАВЛЯТЬСЯ НА УЧЕБА В ФРАНЦУЗСКИЙ ВУЗ С ДВА ДО ШЕСТЬ ТЫСЯЧА ЧЕЛОВЕК,notLF
6774, Я УВЕРЕННЫЙ ЧТО ДЛЯ ВАШ МОЛОДОЙ ЧЕЛОВЕК НАШ ГОСУДАРСТВЕННЫЙ УНИВЕРСИТЕТ МОЧЬ БЫТЬ ОЧЕНЬ ИНТЕРЕСНЫЙ ЕЩЕ И С ТОТ ТОЧКА ЗРЕНИЕ ЧТО ОБУЧЕНИЕ В ОНИ БЕСПЛАТНЫЙ,notLF
6775, НАДО ЗАМЕЧАТЬ ЧТО В ПОСЛЕДНИЙ ГОД МИНИСТЕРСТВО ОБРАЗОВАНИЕ И МИНИСТЕРСТВО ИНОСТРАННЫЙ ДЕЛО ФРАНЦИЯ АКТИВНО РЕКЛАМИРОВАТЬ В РОССИЯ СИСТЕМА ФРАНЦУЗСКИЙ ОБРАЗОВАНИЕ,LF
6776, ПЯТЬ ГОД НАЗАД ПОД ПАТРОНАЖ ЭТОТ ВЕДОМСТВО В МОСКВА БЫТЬ СОЗДАВАТЬ АГЕНТСТВО EDUFRANCE,notLF
6777, В БРОШЮРА РАСПРОСТРАНЯТЬ ЭТОТ АГЕНТСТВО В СТОЛИЧНЫЙ ИНСТИТУТ В ЧАСТНОСТИ ГОВОРИТЬ ОБУЧЕНИЕ В ФРАНЦИЯ ЭТО ПРИОБЩЕНИЕ К ВСЕМИРНО ИЗВЕСТНЫЙ СИСТЕМА ВЫСШИЙ ОБРАЗОВАНИЕ,LF
6778, ВОЗМОЖНОСТЬ ПОСТУПЛЕНИЕ В ОДИН ИЗ ИЗВЕСТНЫЙ ВУЗ ОТ СТАРЫЙ УНИВЕРСИТЕТ СОРБОННА В ПАРИЖ ДО СОВРЕМЕННЫЙ УНИВЕРСИТЕТСКИЙ ЦЕНТР НИЦЦА СОФИЯ АНТИПОЛИС ИСПОЛЬЗОВАТЬ ПОСЛЕДНИЙ ДОСТИЖЕНИЕ НАУКА И ТЕХНИКА,notLF
6779, ВАШ ШАНС ДЕЛАТЬ КАРЬЕРА В ЕВРОПА,notLF
6780, ВПРОЧЕМ ОДИН ДЕЛО ПРОЧИТЫВАТЬ ДРУГОЙ ВИДЕТЬ,notLF
6781, СРАЗУ ЖЕ ПОСЛЕ СВОЙ СОЗДАНИЕ EDUFRANCE НАЧИНАТЬ АКТИВНО ПРОДВИГАТЬ В РОССИЯ ФРАНЦУЗСКИЙ ВЫСШИЙ ШКОЛА,notLF
6782, СЕЙЧАС ПРЕДСТАВИТЕЛЬСТВО EDUFRANCE БЫТЬ В МОСКВА САМАРА САНКТ-ПЕТЕРБУРГ ЕКАТЕРИНБУРГ А В БЛИЖАЙШИЙ БУДУЩЕЕ ОНИ ОТКРЫТИЕ ПЛАНИРОВАТЬ В ВЕСЬ КРУПНЫЙ УНИВЕРСИТЕТСКИЙ ЦЕНТР РОССИЯ,notLF
6783, ГЛАВНЫЙ АРГУМЕНТ РЕКРУТЕР АГИТИРОВАТЬ РОССИЙСКИЙ ГРАЖДАНИН УЧИТЬСЯ В ФРАНЦИЯ КАРЬЕРА МОЖНО ДЕЛАТЬ ТОЛЬКО С ЕВРОПЕЙСКИЙ ДИПЛОМ,notLF
6784, ДЕЙСТВИТЕЛЬНО РОССИЙСКИЙ ДИПЛОМ О ВЫСШИЙ ОБРАЗОВАНИЕ В БОЛЬШИНСТВО СВОЙ ЗА РУБЕЖОМ НЕ КОТИРОВАТЬСЯ А МНОГИЕ ВООБЩЕ НЕ ПРИЗНАВАТЬ,notLF
6785, НЕ СЕКРЕТ И ТО ЧТО МНОГИЕ ИНЖЕНЕРНО-ТЕХНИЧЕСКИЙ ПРЕДМЕТ МЕНЕДЖМЕНТ УПРАВЛЕНИЕ ЭКОНОМИКА И ПРАВО ПРЕПОДАВАТЬ В ЕВРОПЕЙСКИЙ ИНСТИТУТ ХОРОШО ЧЕМ У МЫ,LF
6786, НЕМАЛОВАЖНЫЙ РОЛЬ ИГРАТЬ И СОВРЕМЕННЫЙ МАТЕРИАЛЬНЫЙ ТЕХНИЧЕСКИЙ БАЗА И НОВЫЙ ОБОРУДОВАНИЕ КОТОРЫЙ ОСНАЩАТЬ ИНЖЕНЕРНЫЙ ИНСТИТУТ И УНИВЕРСИТЕТ ФРАНЦИЯ,notLF
6787, ВЕДЬ ЧТО ГРЕХ ТАИТЬ В РОССИЯ БУДУЩИЙ УЧЕНЫЙ И ИНЖЕНЕР ЧАСТО НЕ ИМЕТЬ ВОЗМОЖНОСТЬ ПРОВОДИТЬ ПОЛНОЦЕННЫЙ ИССЛЕДОВАНИЕ ИЗ-ЗА МОРАЛЬНЫЙ И ТЕХНИЧЕСКИЙ ИЗНОС ЛАБОРАТОРИЯ,notLF
6788, БЫТЬ СВОЙ ПРАВДА И В ПРЕВОСХОДСТВО ЕВРОПЕЙСКИЙ ГУМАНИТАРНЫЙ ОБРАЗОВАНИЕ КОТОРЫЙ ИСТОРИЧЕСКИ НЕ БЫТЬ ИДЕОЛОГИЗИРОВАТЬ,notLF
6789," ЗА ТРИ ГОД РАБОТА EDUFRANCE ЗАВЕРБОВЫВАТЬ ОКОЛО 1,5 ТЫСЯЧА РОССИЙСКИЙ СТУДЕНТ",notLF
6790, ПРИ ЭТО ТРЕБОВАНИЕ КОТОРЫЙ ПРЕДЪЯВЛЯТЬ К ПОСТУПАТЬ В ФРАНЦУЗСКИЙ ВУЗ НЕЛЬЗЯ НАЗЫВАТЬ ЧРЕЗМЕРНО ЖЕСТКИЙ,LF
6791, ЖЕЛАТЕЛЬНЫЙ ЗНАТЬ ФРАНЦУЗСКИЙ ЯЗЫК ИМЕТЬ ИНТЕРЕСНЫЙ ДЛЯ ФРАНЦУЗСКИЙ ВУЗ ТЕМА КУРСОВОЙ РАБОТА ИЛИ ДИПЛОМ ПРЕДОСТАВЛЯТЬ НЕСКОЛЬКО ХАРАКТЕРИСТИКА ОТ ИЗВЕСТНЫЙ В ФРАНЦИЯ ПРЕПОДАВАТЕЛЬ,LF
6792, КРОМЕ ТО НАДО ЗАМЕЧАТЬ ЧТО УСЛУГА EDUFRANCE БЕСПЛАТНЫЙ,notLF
6793, КАК ТЕОРЕТИЧЕСКИ БЕСПЛАТНЫЙ ВООБЩЕ ВЫСШИЙ ОБРАЗОВАНИЕ В ФРАНЦИЯ,notLF
6794, ТЕОРЕТИЧЕСКИ ПОТОМУ ЧТО НА САМЫЙ ДЕЛО КАЖДЫЙ ИНСТИТУТ ВЗИМАТЬ С ПОСТУПАТЬ ПЛАТА В РАЗМЕР ОТ 200 ДО 500 ЕВРО ЗА ОФОРМЛЕНИЕ ДОКУМЕНТ,notLF
6795, ЕЩЕ ИНОСТРАННЫЙ СТУДЕНТ ВЫНУЖДАТЬ СНИМАТЬ ЖИЛЬЕ МАЛЕНЬКИЙ ОТДЕЛЬНЫЙ КОМНАТКА В КАМПУС ОБХОДИТЬСЯ ПРИМЕРНО В 200 250 ЕВРО В МЕСЯЦ,notLF
6796, ОПЛАЧИВАТЬ МЕДИЦИНСКИЙ СТРАХОВКА И ПОКУПАТЬ ЕДА,notLF
6797, И НЕСМОТРЯ НА ТО ЧТО ЗА УРОК ДЕЙСТВИТЕЛЬНО НЕ НУЖНЫЙ ПЛАТИТЬ МЕСЯЧНЫЙ РАСХОД СОСТАВЛЯТЬ 1000 1500 ЕВРО НА ЧЕЛОВЕК,notLF
6798, ЕСЛИ УМНОЖАТЬ ЭТОТ СУММА НА 170000 ИНОСТРАННЫЙ СТУДЕНТ ОБУЧАТЬСЯ В ФРАНЦИЯ ТО ПОЛУЧАТЬСЯ ВПОЛНЕ ПРИЛИЧНЫЙ ВЛИВАНИЕ В ЭКОНОМИКА ГОСУДАРСТВО,notLF
6799, ЭКОНОМИЧЕСКИЙ ВЫГОДА ОТ УВЕЛИЧЕНИЕ КВОТА ДЛЯ НАШ ДА И ЛЮБОЙ ДРУГОЙ СТУДЕНТ ОЧЕВИДНЫЙ,notLF
6800, НО ДЕНЬГИ ВПРОЧЕМ НЕ ГЛАВНЫЙ ДВИЖУЩИЙ СИЛА ФРАНЦУЗСКИЙ ОБРАЗОВАТЕЛЬНЫЙ ЭКСПАНСИЯ В РОССИЯ,notLF
6801, НЕДАРОМ ГОСПОДИН БЛАНШМЕЗОН В ПЕРВУЮ ОЧЕРЕДЬ УПОМИНАТЬ О ИНТЕЛЛЕКТУАЛЬНЫЙ ПОТЕНЦИАЛ И ЗНАНИЕ РОССИЙСКИЙ СТУДЕНТ СПОСОБНЫЙ ДВИГАТЬ ВПЕРЕД ОБРАЗОВАНИЕ И НАУКА ОН СТРАНА,notLF
6802, О ЭТО ЖЕ ГОВОРИТЬ В ИНТЕРВЬЮ ИТОГ ПРИЕЗЖАТЬ ПРОШЕДШИЙ ЛЕТО В МОСКВА МИНИСТР ПО ДЕЛО МОЛОДЕЖЬ НАЦИОНАЛЬНЫЙ ОБРАЗОВАНИЕ И НАУЧНЫЙ ИССЛЕДОВАНИЕ ФРАНЦИЯ ЛЮК ФЕРРИ УРОВЕНЬ ТОТ СТУДЕНТ ЧТО СЕЙЧАС УЧИТЬСЯ У МЫ ПОЖАЛУЙ ЛУЧШИЙ В МИР,notLF
6803, ОСОБЕННО В ОБЛАСТЬ НАУЧНЫЙ ИССЛЕДОВАНИЕ И ЛИТЕРАТУРА,notLF
6804, В ТАКОЙ ЧЕЛОВЕК ЗАИНТЕРЕСОВАННЫЙ КАЖДЫЙ СТРАНА,notLF
6805, ЧТОБЫ ПРИВЛЕКАТЬ КАК МОЖНО МНОГО ТАЛАНТЛИВЫЙ СТУДЕНТ И МОЛОДОЙ УЧЕНЫЙ В ПОСЛЕДНИЙ ДВА ГОД ФРАНЦИЯ ОТЛИЧАТЬСЯ СИЛЬНЫЙ ЯЗЫКОВОЙ НАЦИОНАЛИЗМ ПОЙТИ ДАЖЕ НА ТО ЧТОБЫ ПРИНИМАТЬ НА ОБУЧЕНИЕ НЕ ВЛАДЕТЬ ФРАНЦУЗСКИЙ ЯЗЫК ИНОСТРАНЕЦ,LF
6806, ОНИ ТЕПЕРЬ МОЧЬ СЛУШАТЬ ЛЕКЦИЯ НА АНГЛИЙСКИЙ ЯЗЫК ИЛИ НЕСКОЛЬКО МЕСЯЦ ЗА СЧЕТ ИНСТИТУТ ИЗУЧАТЬ ФРАНЦУЗСКИЙ,LF
6807, ОДИН СЛОВО ФРАНЦИЯ ДЕЛАТЬ ВСЕ ВОЗМОЖНЫЙ ЧТОБЫ ПРИВЛЕКАТЬ В СТРАНА ЛУЧШИЙ МОЗГ,notLF
6808, В ЭТОТ КОНТЕКСТ НЕ ТАКОЙ УЖ СТРАННЫЙ ВЫГЛЯДЕТЬ ТОТ ФАКТ ЧТО ФРАНЦИЯ ТАК И НЕ ПОДПИСЫВАТЬ СОГЛАШЕНИЕ С РОССИЯ О ВЗАИМНЫЙ ПРИЗНАНИЕ ДОКУМЕНТ О ОБРАЗОВАНИЕ,LF
6809, ХОТЯ ПОЛ ГОД НАЗАД ВО ВРЕМЯ ВИЗИТ ФРАНЦУЗСКИЙ МИНИСТР ОБРАЗОВАНИЕ РЕЧЬ О ЭТО ИДТИ КАК О ДЕЛО ПРАКТИЧЕСКИ РЕШАТЬ,LF
6810, ГОСПОДИН ФЕРРИ СКАЗАТЬ ТОГДА ИТОГ МЫ ДОГОВАРИВАТЬСЯ С МИНИСТР ФИЛИППОВ О СОВМЕСТНЫЙ РАБОТА ПО УНИФИКАЦИЯ ДИПЛОМ,notLF
6811, ДОГОВАРИВАТЬСЯ ТО ДОГОВАРИВАТЬСЯ А ВОТ УНИФИКАЦИЯ НЕ СЛУЧАТЬСЯ,notLF
6812, С РОССИЙСКИЙ СТОРОНА В ЭТОТ ДЕЛО НИКАКОЙ ПРЕПЯТСТВИЕ НЕ БЫТЬ,notLF
6813, И МИНИСТР ОБРАЗОВАНИЕ ВЛАДИМИР ФИЛИППОВ В УЗКИЙ КРУГ ЖУРНАЛИСТ НЕ МОЧЬ СКРЫВАТЬ ДОСАДА КОММЕНТИРОВАТЬ СИТУАЦИЯ С ПРИЗНАНИЕ НАШ ДИПЛОМ В НЕКОТОРЫЙ СТРАНА ЕВРОПА,LF
6814, МОЖНО КОНЕЧНО ИСКАТЬ ПРИЧИНА ТАКОЙ РЕШЕНИЕ В НЕСООТВЕТСТВИЕ НАШ И ФРАНЦУЗСКИЙ ОБРАЗОВАТЕЛЬНЫЙ ПРОГРАММА,notLF
6815, НО СОВСЕМ ИНАЧЕ ЭТО ВЫГЛЯДЕТЬ НА ФОН АКТИВНЫЙ ОХОТА ЗА ГОЛОВА КОТОРЫЙ ВЕСТИ ФРАНЦИЯ,LF
6816, НЕПРИЗНАНИЕ РОССИЙСКИЙ ДИПЛОМ ДЛЯ МОЛОДОЙ И УМНЫЙ СТРЕМИТЬСЯ ДЕЛАТЬ КАРЬЕРА НЕ ТОЛЬКО В РОССИЯ НО И ЗА РУБЕЖОМ СЕРЬЕЗНЫЙ ПОВОД ДЛЯ ВЫБОР В ПОЛЬЗА НАПРИМЕР СОРБОННА,LF
6817, КРОМЕ ТО УЧЕБНЫЙ ПРОЦЕСС В ЗАПАДНЫЙ ВУЗ УСТРАИВАТЬ ТАК ЧТО СТУДЕНТ УЖЕ С ТРЕТИЙ КУРС ВЕСТИ СЕРЬЕЗНЫЙ НАУЧНЫЙ ИССЛЕДОВАНИЕ,LF
6818, ИНТЕЛЛЕКТУАЛЬНЫЙ ПРОДУКТ ВЫДАВАТЬ СТУДЕНТ ПРИНАДЛЕЖАТЬ СТРАНА ГДЕ ОН УЧИТЬСЯ,notLF
6819, А ЗА ОСОБО ОДАРЕННЫЙ К ТО ЖЕ ПРИСТАЛЬНО СЛЕДИТЬ НАУЧНЫЙ И ПРОФЕССИОНАЛЬНЫЙ СООБЩЕСТВО,notLF
6820, И ОЧЕНЬ ЧАСТО СТУДЕНТ ВЫПУСКНОЙ КУРС УЖЕ ПРЕДЛАГАТЬ КОНТРАКТ НА РАБОТА,notLF
6821, ПРАВДА ПРЕДСТАВИТЕЛЬ РОССИЙСКИЙ МИНИСТЕРСТВО ОБРАЗОВАНИЕ НЕ СЧИТАТЬ ЧТО ПОЛИТИКА ФРАНЦУЗ УГРОЖАТЬ НАШ ЭКОНОМИКА,notLF
6822, ВОТ ЧТО СКАЗАТЬ ИТОГ СОВЕТНИК ЗАМЕСТИТЕЛЬ МИНИСТР ПО МЕЖДУНАРОДНЫЙ СВЯЗЬ АЛЕКСЕЙ БИРЮКОВ НАШ СТУДЕНТ ВОЛЬНЫЙ ДЕЛАТЬ ВСЕ ЧТО ОНИ СЧИТАТЬ НУЖНЫЙ,notLF
6823, ХОРОШИЙ БЫ ОНИ ТРУДИТЬСЯ ЗДЕСЬ ЕСЛИ БЫ У МЫ БЫТЬ ДОСТОЙНЫЙ УСЛОВИЕ ДЛЯ ОНИ РАБОТА,notLF
6824, И ЕСЛИ ЧЕЛОВЕК ПОЛУЧАТЬ ДИПЛОМ МГУ РЕШАТЬ ПОВЫШАТЬ КВАЛИФИКАЦИЯ В АМЕРИКА ФИНЛЯНДИЯ ИЛИ ФРАНЦИЯ ПУСТЬ ОН ЭТО ДЕЛАТЬ,notLF
6825, ЧЕЛОВЕК ВОЗВРАЩАТЬСЯ ПОСЛЕ ТАКОЙ СТАЖИРОВКА МНОГО ЧЕМ ТОТ КТО ОСТАВАТЬСЯ РАБОТАТЬ ЗА ГРАНИЦА,notLF
6826, НАЛОГ НА ТАЙНА,notLF
6827, ДВЕНАДЦАТЬ СТРАНА ЕВРОПЕЙСКИЙ СОЮЗ ОТМЕНЯТЬ ТАЙНА ВКЛАД,notLF
6828, ПО НОВЫЙ ПРАВИЛО ВЕСЬ БАНК АВТОМАТИЧЕСКИ ДОЛЖЕН БЫТЬ НАПРАВЛЯТЬ НАЛОГОВЫЙ ОРГАН ИНФОРМАЦИЯ О СВОЙ КЛИЕНТ И ОНИ СЧЕТ,notLF
6829, ДЛЯ ТОТ ЖЕ ВЛАДЕЛЕЦ ДЕПОЗИТ КТО НЕ ЗАХОТЕТЬ ПЛАТИТЬ НАЛОГ С ПРОЦЕНТ ОСТАВАТЬСЯ ОДИН ПУТЬ ПЕРЕВОДИТЬ ДЕНЬГИ НА БАГАМЫ,LF
6830, В ЕВРОПЕЙСКИЙ СОЮЗ ПРОИСХОДИТЬ ПОДЛИННЫЙ РЕВОЛЮЦИЯ 12 СТРАНА СТАРЫЙ СВЕТ ПРИНИМАТЬ РЕШЕНИЕ О ФАКТИЧЕСКИЙ УПРАЗДНЕНИЕ БАНКОВСКИЙ ТАЙНА,LF
6831, О ЭТО ДОГОВАРИВАТЬСЯ МИНИСТР ФИНАНСЫ ЕС НА САММИТ В БРЮССЕЛЬ,LF
6832, СВЯТАЯ СВЯТЫХ ЛИБЕРАЛЬНЫЙ РЫНОЧНЫЙ ЭКОНОМИКА ПАСТЬ ЖЕРТВА В БОРЬБА С НАЛОГОВЫЙ УКЛОНИЗМ КОТОРЫЙ ЕВРОСОЮЗ ВЕСТИ НА ПРОТЯЖЕНИЕ ПОСЛЕДНИЙ ДЕСЯТИЛЕТИЕ,notLF
6833, СТРЕМИТЕЛЬНЫЙ ИНТЕГРАЦИЯ ЕВРОПЕЙСКИЙ ГОСУДАРСТВО НЕ ТОЛЬКО ВЗЛАМЫВАТЬ ГОСУДАРСТВЕННЫЙ ГРАНИЦА И ХОРОНИТЬ НАЦИОНАЛЬНЫЙ ВАЛЮТА НО И ЗАМЕТНО УСКОРЯТЬ ПРОЦЕСС МИГРАЦИЯ КАПИТАЛ,notLF
6834, ИНОЙ СЛОВО ФРАНЦУЗ ТЕПЕРЬ ДЕРЖАТЬ ДЕНЬГИ В БЕЛЬГИЯ НЕМЕЦ ДЕРЖАТЬ ДЕНЬГИ В АВСТРИЯ ТО ЕСТЬ ТАМ ГДЕ НАДЕЖНЫЙ ГДЕ ВЫСОКИЙ ПРОЦЕНТ И ГДЕ БАНКОВСКИЙ КЛЕРК НЕ ЗАДАВАТЬ ЛИШНИЙ ВОПРОС,LF
6835, ЕСТЕСТВЕННО ДАЛЕКО НЕ ВЕСЬ ИЗ ИНОСТРАННЫЙ ВКЛАДЧИК ГОРЕТЬ ЖЕЛАНИЕ ПЛАТИТЬ У СЕБЯ НА РОДИНА НАЛОГ С ПРОЦЕНТ ПОЛУЧАТЬ В ВИДЕ ДОХОД НА ДЕПОЗИТ,LF
6836, КОНКРЕТНО ЭТО ВЫГЛЯДЕТЬ ТАК АВСТРИЙСКИЙ ГРАЖДАНИН ПРОЖИВАТЬ ГДЕ-НИБУДЬ В ВЕНА ПЛАТИТЬ С ДОХОД ОТ СВОЙ ВКЛАД НАЛОГ ПО СТАВКА 25 ПРОЦЕНТ,LF
6837, В ТОТ ЖЕ ВРЕМЯ ГРАЖДАНИН ФРГ ПРОЖИВАТЬ В БЕРЛИН НО ХРАНИТЬ ДЕНЬГИ В ОДИН ИЗ ВЕНСКИЙ БАНК АВСТРИЙСКИЙ ГОСУДАРСТВО ПЛАТИТЬ НИЧТО НЕ ДОЛЖЕН,LF
6838, ПРИ ЭТО ОН ОБХОДИТЬ СТОРОНА И НЕМЕЦКИЙ НАЛОГОВИК НЕ ДЕКЛАРИРОВАТЬ НАЛИЧИЕ ВКЛАД ЗА РУБЕЖОМ,notLF
6839, ЗАПРОС ЖЕ НЕМЕЦКИЙ НАЛОГОВИК АВСТРИЙСКИЙ БАНК ВПРАВЕ ИГНОРИРОВАТЬ ПОСКОЛЬКУ СЕ НАРУШАТЬ ПРИНЦИП ТАЙНА ВКЛАД,notLF
6840, БЕГСТВО КАПИТАЛ ПРИНИМАТЬ ОБВАЛЬНЫЙ ХАРАКТЕР В ТОТ СТРАНА ГДЕ НАЛОГОВЫЙ ОРГАН НАКОНЕЦ ПОЛУЧАТЬ ДОСТУП К ЗАКРЫТЫЙ БАНКОВСКИЙ ИНФОРМАЦИЯ,LF
